question_id,category_1,category_2,category_3,question_text_original,question_text_rev,variants_1,variants_2,variants_3,variants_4,variants_5,variants_6,variants_7,variants_8,variants_9,variants_10,variants_11,variants_12,variants_13,variants_14,variants_15,variants_16,variants_17,variants_18,,,,,variants_19,,,,answer
56af6c01e0e2eee2aa000124,Bike Noproblem,Info e Acquisto,Auto e Mobilità,Che cosa garantisce la  garanzia Furto per la polizza Bike Noproblem?,Che cosa garantisce la garanzia Furto per la polizza Bike Noproblem?,"In caso di furto della bicicletta, cosa garantisce Europ Assistance?",Quali sono le condizioni per ottenere un indennizzo se si subisce il furto della bici?,Come funziona la garanzia Furto per la polizza Bike Noproblem?,Voglio assicurare la mia bicicletta contro il furto: è possibile,La garanzia Furto è sempre valida oppure presenta delle limitazioni?,La garanzia Furto copre tutte le tipologie di bicicletta?,,,,,,,,,,,,,,,,,,,,,"Europ Assistance riconosce un indennizzo in caso di furto totale della bicicletta, con vetustà massima 36 mesi (come da comprovata data di acquisto su scontrino/ fattura). L'indennizzo verrà riconosciuto in base al valore della bicicletta nuova, sulla quale verranno applicati degrado e scoperto (come da tabella riportata nel fascicolo informativo). La garanzia è operante quando la bicicletta è custodita all'interno dei locali dell' abitazione, compresi box, cantine e dimore saltuarie, purché regolarmente chiusi a chiave."
56af6c02e0e2eee2aa000127,Bike Noproblem,Info e Acquisto,Auto e Mobilità,Le garanzie di RC e Tutela Legale per la polizza Bike Noproblem sono vendibili singolarmente?,Nella polizza Bike Noproblem le garanzie di RC e Tutela Legale sono vendibili separatamente?,Posso acquistare singolarmente le garanzie di RC e Tutela Legale all'interno della polizza Bike Noproblem?,Le garanzie di RC e Tutela Legale sono comprese in tutte le versioni della polizza Bike Noproblem?,Quale versione della polizza Bike Noproblem ha incluse le garanzie RC e Tutela Legale?,Il pacchetto base della polizza Bike Noproblem include le garanzie RC e Tutela Legale?,,,,,,,,,,,,,,,,,,,,,,,"No, per le formule Urban e Sport, le garanzie di RC e Tutela Legale sono due garanzie che completano il pacchetto base e non possono essere acquistate separatamente. Per la formula Ciclotour le garanzie sono entrambe già comprese nel pacchetto."
56af6c0de0e2eed908000044,Flexi,Info e Acquisto,Viaggi,Che cosa garantisce la polizza Flexi Viaggi?,Quali garanzie offre la polizza Flexi Viaggi?,Che cosa garantisce la polizza Flexi Viaggi?,In cosa consiste la polizza Flexi Viaggi?,Come funziona la polizza Flexi Viaggi?,Quali sono le coperture assicurate dalla polizza Flexi VIaggi?,Quali servizi mi assicuro acquistando la polizza Flexi Viaggi?,Quanto durano le garanzie offerte dalla polizza Flexi Viaggi?,Quali vantaggi mi offre la polizza Flexi Viaggi?,,,,,,,,,,,,,,,,,,,,"Il modulo Flexi Viaggi ti permette di costruire il tuo piano di assistenza sanitaria in viaggio per la copertura spese mediche e bagaglio con durata annuale, mediante una comoda soluzione ad un abbonamento mensile."
56af6c0fe0e2eed908000047,Flexi,Info e Acquisto,Viaggi,Cosa cambia tra Flexi Viaggi e la formula Annuale Multiviaggio?,Quali sono le differenze tra la polizza Flexi Viaggi e la polizza Viaggi Nostop Annuale Multiviaggio?,Vorrei conoscere le differenze tra la polizza Flexi Viaggi e la formula Annuale Multiviaggio?,Cosa cambia se scelgo la polizza Flexi Viaggi al posto della polizza Viaggi Nostop Annuale Multiviaggio?,,,,,,,,,,,,,,,,,,,,,,,,,"Il modulo Flexi Viaggi prevede nella versione singolo un massimale di Rimborso Spese Mediche più elevato - euro 300.000 - rispetto alla Viaggi NoStop Annuale Multiviaggio, e un pagamento della polizza mensile, e non annuale  anticipato. Flexi viaggi è inoltre acquistabile nella versione famiglia ( ad un costo più conveniente rispetto alle soluzioni individuali)."
56af6c0fe0e2eed90800004a,Flexi,Info e Acquisto,Auto e Mobilità,Che cosa garantisce la polizza Flexi Auto?,Quali garanzie offre la polizza Flexi Auto?,Che cosa garantisce la polizza Flexi Auto?,In cosa consiste la polizza Flexi Auto?,Come funziona la polizza Flexi Auto?,Quali coperture offre la polizza Flexi Auto?,Quali servizi mi assicuro acquistando la polizza Flexi Auto?,Quali vantaggi mi offre la polizza Flexi Auto?,La polizza Flexi Auto prevede un servizio di auto sostitutiva?,La polizza Flexi Auto garantisce l'assicurato anche se non si trova alla guida del veicolo?,,,,,,,,,,,,,,,,,,,"Il modulo Flexi Auto garantisce copertura completa all'assicurato che sia alla guida di un veicolo o che sia passeggero. Non è quindi necessario fornire un numero di targa, inoltre, è previsto un  servizio di auto sostitutiva- Stop & Go -  direttamente sul luogo del fermo."
56af6c10e0e2eed90800004d,Flexi,Info e Acquisto,Auto e Mobilità,Quanti soccorsi stradali possono essere erogati nell'arco di validità della polizza Flexi Auto?,Quanti soccorsi stradali possono essere richiesti durante il periodo di validità della polizza Flexi Auto?,Quante volte posso chiamare l'assistenza stradale se ho una polizza Flexi Auto?,Esiste un limite al numero di interventi di assistenza stradale che un assicurato può richiedere se ha una polizza Flexi Auto?,Ho una polizza Flexi Auto: quanti interventi di soccorso stradale posso richiedere?,Ho stipulato una polizza Flexi Auto: quante volte posso fare la richiesta di assistenza stradale?,,,,,,,,,,,,,,,,,,,,,,,Si possono richiedere fino a 6 interventi di assistenza per anno assicurativo.
56af6c11e0e2eed908000050,Flexi,Info e Acquisto,Salute,Che cosa garantisce la polizza Flexi Salute?,Quali garanzie offre la polizza Flexi Salute?,Che cosa garantisce la polizza Flexi Salute?,In cosa consiste la polizza Flexi Salute?,Come funziona la polizza Flexi Salute?,Quali coperture offre la polizza Flexi Salute?,Quali servizi mi assicuro acquistando la polizza Flexi Salute?,Quali vantaggi mi offre la polizza Flexi Salute?,Quali tipologie di infortuni sono coperti dalla polizza Flexi Salute?,"In caso di infortunio, che tipo di indennizzo è assicurato con la polizza Flexi Salute?",La polizza Flexi Salute garantisce dei servizi anche durante il periodo riabilitativo post infortunio?,È possibile assicurare tutti i membri della famiglia con la polizza Flexi Salute?,,,,,,,,,,,,,,,,,"Il modulo Flexi Salute vale per gli infortuni che l'assicurato subisce nello svolgimento delle attività professionali principali e secondarie, e di ogni altro tipo di attività che non abbia carattere professionale. La polizza garantisce un indennizzo certo e predefinito, presentando solo la documentazione ospedaliera, a seguito di infortunio. È previsto, inoltre, l'invio di baby sitter, colf, personale medico e paramedico, riabilitativo per affrontare il periodo successivo ad un infortunio. Flexi salute è disponibile anche nella versione Nucleo per assicurare tutti i componenti della famiglia."
56af6c12e0e2eed908000053,Flexi,Info e Acquisto,Salute,Flexi Salute è valida anche per gli infortuni che avvengono all'estero?,La polizza Flexi Salute è valida anche per gli infortuni che avvengono all'estero?,La polizza Flexi Salute garantisce anche gli infortuni avvenuti all'estero?,Posso stipulare una polizza Flexi Saluti che copra gli infortuni che avvengono all'estero?,Se sottoscrivo una polizza Flexi Salute sarò coperto anche in caso di infortunio all'estero?,La polizza Flexi Salute è valida sia in Italia che all'estero?,,,,,,,,,,,,,,,,,,,,,,,Sono garantiti solamente gli infortuni che avvengono in Italia.
56af6c13e0e2eed908000056,Flexi,Info e Acquisto,Casa e Famiglia,Che cosa garantisce la polizza Flexi Casa?,Quali garanzie offre la polizza Flexi Casa?,Che cosa garantisce la polizza Flexi Casa?,In cosa consiste la polizza Flexi Casa?,Come funziona la polizza Flexi Casa?,Quali servizi sono garantiti dalla polizza Flexi Casa?,Quali coperture offre la polizza Flexi Casa?,Quali vantaggi mi offre la polizza Flexi Casa?,Per quali tipologie di interventi posso contare sulla polizza Flexi Casa?,"Se ho una polizza Flexi Casa,in quali situazioni mi viene inviata assistenza",,,,,,,,,,,,,,,,,,,"Il modulo Flexi Casa garantisce l'assistenza all'abitazione tramite l'invio di tecnici qualificati in caso di emergenza domestica, quali l'invio di un fabbro, idraulico, elettricista, vetraio."
56af6c14e0e2eed908000059,Flexi,Info e Acquisto,Casa e Famiglia,Quanti interventi si possono richiedere nell'arco di validità della polizza Flexi Casa?,Quanti interventi si possono richiedere durante il periodo di validità della polizza Flexi Casa?,Quante volte posso chiamare l'assistenza se ho una polizza Flexi Casa?,Esiste un limite al numero di interventi di assistenza domestica che un assicurato può richiedere se ha una polizza Flexi Casa?,Ho una polizza Flexi Casa: quanti interventi di assistenza domestica posso richiedere?,Ho stipulato una polizza Flexi Casa: quante volte posso fare la richiesta di assistenza domestica?,,,,,,,,,,,,,,,,,,,,,,,Si possono richiedere 3 interventi per tipo di prestazione e per anno assicurativo.
56af6c15e0e2eed90800005c,Easy,Info e Acquisto,"Viaggi, Auto e Mobilità, Casa e Famiglia, Salute",Che cos'è la Easy Card?,Cos'è l'abbonamento Easy?,In cosa consiste l'abbonamento Easy?,Come funziona l'abbonamento Easy?,Quali servizi mi offre l'abbonamento Easy?,Quanto costa l'abbonamento Easy?,Quali vantaggi mi offre l'abbonamento Card?,Che tipo di canone prevede l'abbonamento Easy?,Quale tipologia di assistenza garantisce l'abbonamento Easy?,Quante e quali prestazioni sono assicurate dall'abbonamento Easy?,,,,,,,,,,,,,,,,,,,"Easy è la nostra soluzione ad abbonamento che ti permette di costruire un piano di assistenza giornaliera partendo da soli euro 7,50 al mese. \n\nCon easy puoi chiamare la Centrale Operativa ogni volta che vuoi e richiedere 10 diverse tipologie di consulenze, accedere a 4 servizi on line per gestire in sicurezza i propri dati personali (bancari, sanitari e legati  alla mobilità), accedere a un ventaglio di benefit"
56af6c16e0e2eed90800005f,Easy,Info e Acquisto,"Viaggi, Auto e Mobilità, Casa e Famiglia, Salute",Qual è la validità di Easy?,Qual è la validità dell'abbonamento Easy?,Quanto dura l'abbonamento Easy?,Quali formule sono previste per l'abbonamento Easy?,Quale tipologia di abbonamento posso scegliere?,Posso scegliere la durata dell'abbonamento Easy?,,,,,,,,,,,,,,,,,,,,,,,Puoi scegliere Easy con validità annuale o Easy con validità mensile.
56af6c17e0e2eed908000062,Eura Salute Ogni Giorno,Info e Acquisto,Salute,Cosa garantisce la Polizza Eura Salute Ogni Giorno?,Quali garanzie offre la polizza Eura Salute Ogni Giorno?,Cosa garantisce la polizza Eura Salute Ogni Giorno?,In cosa consiste la polizza Eura Salute Ogni Giorno?,Come funziona la polizza Eura Salute Ogni giorno?,Quali servizi sono garantiti dalla polizza Eura Salute Ogni Giorno?,Quali coperture offre la polizza Eura Salute Ogni Giorno?,Quali servizi mi assicuro acquistando la polizza Eura Salute Ogni Giornp?,Quali indennizzi prevede la polizza Eura Salute Ogni Giorno?,La polizza Eura Salute Ogni Giorno prevede un indennizzo anche in caso di ricovero ospedaliero senza intervento?,La polizza Eura Salute Ogni Giorno è valida anche prima e dopo un intervento chirurgico?,Quali spese sono coperte dalla polizza Eura Salute Ogni Giorno?,,,,,,,,,,,,,,,,,"Con l'opzione “Ogni Giorno” viene erogato un indennizzo a seguito di intervento chirurgico dell'assicurato, anche in caso di day hospital, reso necessario da una malattia, da infortunio, da parto con taglio cesareo e da aborto.\nSono  incluse le spese mediche sostenute per visite specialistiche indagini diagnostiche inclusi ticket sanitari nei 100 gg prima e dopo l'intervento.\nE nel caso si abbia un ricovero senza intervento viene dato un indennizzo di 100 € al  giorno x ogni di ricovero\n"
56af6c17e0e2eed908000065,Eura Salute Ogni Giorno,Info e Acquisto,Salute,Se l'intervento avviene in struttura pubblica la polizza Eura Salute Ogni giorno mi copre?,La polizza Eura Salute Ogni Giorno mi copre anche se l'intervento avviene presso una struttura pubblica?,Gli interventi presso strutture pubbliche sono assicurati dalla polizza Eura Salute Ogni Giorno?,L'indennizzo previsto dalla polizza Eura Salute Ogni Giorno è assicurato anche in caso di intervento presso una struttura pubblica?,"Se mi sottopongo ad un intervento presso una struttura pubblica, sono comunque garantito dalla polizza Eura Salute Ogni Giorno?","Se mi opero presso una struttura pubblica, posso sempre contare sulla polizza Eura Salute Ogni Giorno?",,,,,,,,,,,,,,,,,,,,,,,Si l'indennizzo è erogato anche in caso di intervento in struttura pubblica.
56af6c18e0e2eed908000068,Eura Salute Ogni Giorno,Info e Acquisto,Salute,Se l'intervento avviene in regime ambulatoriale sono coperto?,Con  la polizza Eura Salute Ogni Giorno sono coperti anche gli interventi che avvengono in regime ambulatoriale?,Con  la polizza Eura Salute Ogni Giorno sono coperto anche se l'intervento avviene in regime ambulatoriale?,La polizza Eura Salute Ogni Giorno prevede un indennizzo anche per gli interventi che avvengono in regime ambulatoriale?,Con  la polizza Eura Salute Ogni Giorno quale tipologia di  indennizzo è prevista per gli inteventi che avvengono in regime ambulatoriale?,La polizza Eura Salute Ogni Giorno è valida anche per gli interventi di chirurgia ambulatoriale?,,,,,,,,,,,,,,,,,,,,,,,Si sono coperti anche gli interventi eseguiti in regime ambulaturiale con un indennizzo fisso di 100 €
56af6c19e0e2eed90800006b,Eura Salute Ogni Giorno,Info e Acquisto,Salute,La polizza Eura Salute Ogni Giorno copre visite specialistiche di qualsiasi genere?,Quali tipologie di visite specialistiche sono coperte dalla polizza Eura Salute Ogni Giorno?,La polizza Eura Salute Ogni Giorno copre visite specialistiche di qualsiasi genere?,Le visite specialistiche sono garantite dalla polizza Eura Salute Ogni Giorno?,Vi sono delle limitazioni fra le visite specialistiche che risultano coperte dalla polizza Eura Salute Ogni Giorno?,Posso contare sulla polizza Eura Salute Ogni Giorno per le visite specialistiche?,"Se ho la polizza Eura Salute Ogni Giorno, sono assicurato anche per le visite specialistiche?",Quali sono le condizioni per la copertura delle visite specialistiche da parte della polizza Eura Salute Ogni Giorno?,,,,,,,,,,,,,,,,,,,,,"Le visite specialistiche garantite dalla polizza sono quelle sostenute nei 90 giorni prima e nei 90 giorni successivi al ricovero, purché relative agli eventi indennizzabili ai termini di polizza."
56af6c1ae0e2eed90800006e,Eura Casa Tutto Compreso,Info e Acquisto,Casa e Famiglia,"Ho una polizza Eura Casa Tutto Compreso, come viene calcolato  il valore dell'Incendio Fabbricato?","Se stipulo una polizza Eura Casa Tutto Compreso, come viene calcolato il valore dell'Incendio del Fabbricato?",Ho una polizza Eura Casa Tutto Compreso: come viene calcolato il valore dell'Incendio del Fabbricato?,Come viene stimato il valore dell'Incendio del Fabbricato per la polizza Eura Casa Tutto Compreso?,Qual è il valore dell'Incendio del Fabbricato ai fini della polizza Eura Casa Tutto Compreso?,Voglio sottoscrivere una polizza Eura Casa Tutto Compreso: come si calcola il valore dell'Incendio del Fabbricato?,Europ Assistance come valuta il valore dell'Incendio del Fabbricato per la polizza Eura Casa Tutto Compreso?,,,,,,,,,,,,,,,,,,,,,,"La somma assicurata per il fabbricato viene determinata considerando i metri quadrati relativi alla superficie interna calpestabile aumentata del 15%, per considerare anche la superficie dei muri interni dell'abitazione. Nel calcolo dei metri quadrati si includono anche quelli relativi a box,  cantine, mansarde anche non abitabili e ogni altra dipendenza."
56af6c1be0e2eed908000071,Eura Casa Tutto Compreso,Info e Acquisto,Casa e Famiglia,"Ho una polizza Eura Casa Tutto Compreso, posso assicurare anche i pannelli solari e fotovoltaici installati sulla mia abitazione?","Ho una polizza Eura Casa Tutto Compreso, posso assicurare anche i pannelli solari e fotovoltaici installati sulla mia abitazione?",Nella polizza Eura Casa Tutto Compreso posso aggiungere l'assicurazione anche ai pannelli solari e fotovoltaici della mia abitazione?,La polizza Eura Casa Tutto Compreso prevede anche l'assicurazione dei pannelli solari e fotovoltaici presenti sull'abitazione?,I pannelli solari e fotovoltaici della mia abitazione possono essere assicurati con la polizza Eura Casa Tutto Compreso?,Come funziona la polizza Eura Casa Tutto Compreso relativamente ai pannelli solari e fotovoltaici?,Anche i pannelli solari e fotovoltaici sono assicurabili con la polizza Eura Casa Tutto Compreso?,Come posso assicurare i pannelli solari e fotovoltaici della mia abitazione?,Quale copertura assicurativa può essere richiesta per i pannelli solari e fotovoltaici?,,,,,,,,,,,,,,,,,,,,È possibile richiedere che la copertura venga estesa anche ai pannelli solari e fotovoltaici solo per il rischio incendio e scoppio.
56af6c1ce0e2eed908000074,Eura Casa Tutto Compreso,Info e Acquisto,Casa e Famiglia,"Ho una polizza Eura Casa Tutto Compreso, posso assicurare eventuali danni al contenuto di un immobile di mia proprietà arrecati da parte di un affittuario?",La polizza Eura Casa Tutto Compreso copre anche gli eventuali danni causati dagli affittuari?,Ho una polizza Eura Casa Tutto Compreso: posso assicurare eventuali danni al contenuto di un immobile di mia proprietà arrecati da parte di un affittuario?,Posso assicurare un immobile di mia proprietà contro gli eventuali danni causati dagli affittuari con la polizza Eura Casa Tutto Compreso?,"Se ho una polizza Eura Casa Tutto Compreso, sono coperto anche nei confronti degli eventuali danni arrecati dagli affittuari?","Se gli affittuari causano danni ad un immobile di mia proprietà, io risulto coperto dalla polizza Eura Casa Tutto Compreso?",Posso stipulare una polizza Eura Casa Tutto Compreso per garantirmi contro gli eventuali danni arrecati dagli affittuari ad un immobile di mia proprietà?,,,,,,,,,,,,,,,,,,,,,,"La polizza Eura Casa Tutto Compreso non copre questo specifico rischio, è possibile tuttavia che l'affittuario stipuli una polizza che lo tuteli sulla responsabilità civile della conduzione dell'abitazione ."
56af6c21e0e2eed908000083,Domande Generiche,Info e Acquisto,"Viaggi, Auto e Mobilità, Casa e Famiglia, Salute","Ho bisogno di informazioni relative al mio contratto, dove posso contattarvi?",Come posso contattarvi per avere informazioni sul mio contratto?,"Ho bisogno di informazioni relative al mio contratto, dove posso contattarvi?",Quale numero devo chiamare per avere informazioni sul mio contratto?,"Se mi servono informazioni sul mio contratto, come vi posso contattare?","Devo contattarvi per avere dei chiarimenti sul mio contratto, quale numero devo chiamare?",Come posso avere dei chiarimenti sul mio contratto?,,,,,,,,,,,,,,,,,,,,,,"Per informazioni sul tuo contratto, puoi chiamare al numero verde Servizio Clienti  800.01.35.29 dalle ore 08.00 alle ore 20.00 attivo dal lunedì al sabato esclusi i festivi."
56af6c21e0e2eed908000086,Domande Generiche,Info e Acquisto,"Viaggi, Auto e Mobilità, Casa e Famiglia, Salute",Come posso fare per disdire la mia polizza Europ Assistance?,Come faccio a disdire la mia polizza Europ Assistance?,Come ottenere la disdetta della mia polizza?,Quali sono le istruzioni da seguire per disdire la mia polizza?,Come comunicare la disdetta della mia polizza?,Come posso inviare la disdetta della mia polizza?,Voglio disdire la mia polizza: come faccio?,Quali sono le modalità per disdire la mia polizza?,Come posso disdire la mia polizza?,Vorrei disdire la mia polizza.,,,,,,,,,,,,,,,,,,,"Puoi inviare richiesta di disdetta della polizza con lettera raccomandata indirizzata a Europ Assistance Spa – Piazza Trento 8, 20135 Milano almeno 30 giorni prima della data di scadenza. In alternativa puoi inviare richiesta anche via fax al numero 02.58.47.70.34 o via email all'indirizzo servizio.clienti@europassistance.it"
56af6c22e0e2eed908000089,Domande Generiche,Rimborso Sinistri,"Viaggi, Auto e Mobilità, Casa e Famiglia, Salute","Ho bisogno di informazioni sullo stato del mio sinistro, come posso ottenerle?",Come posso ottenere informazioni sullo stato del mio sinistro?,Come posso avere aggiornamenti sul mio sinistro?,Vorrei informazioni sul mio sinistro.,"Ho un sinistro aperto, come faccio a sapere quando verrò pagato?",Quale numero devo chiamare per avere informazioni sul mio sinistro?,Esiste un'area del sito di Europ Assistance dedicata all'aggiornamento dello stato dei sinistri?,Chi devo contattare per avere informazioni sul mio sinistro?,Vorrei essere aggiornato sullo stato del mio sinistro.,"Se ho sporto denuncia di sinistro online, come faccio a ricevere aggiornamenti?",Ho bisogno di informazioni sul mio sinistro.,Mi servono informazioni sul mio sinistro.,A che punto è il mio sinistro?,,,,,,,,,,,,,,,,"Puoi contattarci al numero 800.90.48.91 oppure, se hai fatto la denuncia online, puoi controllare gli aggiornamenti sul sito https://sinistrionline.europassistance.it/"
56af6c23e0e2eed90800008c,Domande Generiche,Info e Acquisto,"Viaggi, Auto e Mobilità, Casa e Famiglia, Salute",A chi posso rivolgermi per sporgere eventuali reclami?,Come faccio per sporgere un reclamo?,A chi posso rivolgermi per sporgere eventuali reclami?,Vorrei sporgere reclamo.,Quali sono le modalità per sporgere reclamo?,"Ho subito un disservizio e vorrei presentare reclamo, come faccio?",È possibile sporgere reclamo online?,A chi devo spedire la mia lettera di reclamo?,Come posso presentare reclamo nei confronti di Europ Assistance?,Come posso sporgere reclamo se non sono soddisfatto dei servizi di Europ Assistance?,,,,,,,,,,,,,,,,,,,"Eventuali reclami nei confronti dell'impresa (aventi ad oggetto la gestione contrattuale o la gestione dei sinistri) devono essere inoltrati per iscritto a Europ Assistance Italia S.p.A., Ufficio Reclami, Piazza Trento, 8 – 20135 Milano, Fax 02.58.47.71.28, indirizzo e-mail: ufficio.reclami@europassistance.it"
56af6c24e0e2eed90800008f,Domande Generiche,Info e Acquisto,"Viaggi, Auto e Mobilità, Casa e Famiglia, Salute",Posso rinnovare la mia polizza dal sito?,Posso rinnovare la mia polizza dal sito?,È possibile rinnovare una polizza online?,La mia polizza può essere rinnovata dalla mia area personale sul sito di Europ Assistance?,Esiste una procedura per rinnovare la mia polizza direttamente dal sito?,Quando è possibile rinnovare una polizza dal sito?,Quali istruzioni devo seguire per rinnovare la mia polizza dal sito?,"Devo rinnovare la mia polizza, posso farlo online?",,,,,,,,,,,,,,,,,,,,,"Si solo se la polizza è stata acquistata direttamente sul sito o telefonicamente. E' sufficiente accedere all'area riservata nella sessione ""le mie polizze""."
56af6c25e0e2eed908000092,Domande Generiche,Info e Acquisto,"Viaggi, Auto e Mobilità, Casa e Famiglia, Salute",Non ricordo più la mia login e password. Come faccio a recuperarle?,Non ricordo più UserName e password: come faccio a recuperarle?,"Ho dimenticato UserName e password, come posso recuperarle?",È possibile recuperare UserName e password?,Ho bisogno di recuperare UserName e password.,"Se non ricordo più UserName e password, come posso recuperarle?",Istruzioni per il recupero di UserName e password.,"Ho perso UserName e password, come posso recuperarle?",,,,,,,,,,,,,,,,,,,,,"Contattando il numero verde 800.44.33.22, potrai richiedere l'invio della UserName via e mail.\nUna volta ricevuta la UserName potrai recuperare la Password direttamente dal sito, utilizzando la funzione ""Recupero password""."
56af6c28e0e2eed90800009b,Domande Generiche,Info e Acquisto,"Viaggi, Auto e Mobilità, Casa e Famiglia, Salute",Come posso vedere i preventivi già calcolati?,Come posso vedere i preventivi già calcolati?,Dove trovo i preventivi già calcolati nella mia area riservata del sito?,"Ho salvato un preventivo e vorrei completare l'acquisto, dove posso trovarlo?",Posso rivedere i preventivi che ho già calcolato nel sito?,"Se ho calcolato un preventivo nel sito, posso ritrovarlo in un secondo momento?",Istruzioni per ritrovare i preventivi già calcolati.,I preventivi già calcolati vengono salvati nella mia area riservata del sito?,,,,,,,,,,,,,,,,,,,,,"Trovi i preventivi che hai già calcolato nella tua Area Clienti, nella sezione ""Acquisti e preventivi"", alla voce ""I tuoi preventivi""."
