question_id,category_1,category_2,category_3,question_text_original,question_text_rev,variants_1,variants_2,variants_3,variants_4,variants_5,variants_6,variants_7,variants_8,variants_9,variants_10,variants_11,variants_12,variants_13,variants_14,variants_15,variants_16,variants_17,variants_18,,,,,variants_19,,,,answer
56af6c52e0e2eed908000125,Infortuni In Volo,Info e Acquisto,Viaggi,Per acquistare una Viaggi Nostop Vacanza Infortuni in Volo è necessario assicurare tutti i voli aerei presenti in una vacanza?,Per acquistare una Viaggi Nostop Vacanza Infortuni in Volo è necessario assicurare tutti i voli aerei presenti in una vacanza?,La polizza Viaggi Nostop Vacanza Infortuni in Volo deve necessariamente coprire tutti i voli aerei da effettuare durante la vacanza?,Con la polizza Viaggi Nostop Vacanza Infortuni in Volo sono vincolato ad assicurare tutti i voli aerei della vacanza?,La polizza Viaggi Nostop Vacanza Infortuni in Volo copre tutti i voli aerei della vacanza?,"Se acquisto una polizza Viaggi Nostop Vacanza Infortuni in volo, devo assicurare tutti i voli presenti nella vacanza?",Tutti i voli presenti nella vacanza sono assicurati se acquisto una polizza Viaggi No stop Vacanza Infortuni in Volo?,,,,,,,,,,,,,,,,,,,,,,"No, puoi scegliere di assicurare il solo volo di andata, i voli di andata e ritorno oppure tutti i voli che effettui durante il viaggio"
56af6c53e0e2eed908000128,Eura Casa Luce & Gas,Info e Acquisto,Casa e Famiglia,Cosa offre la polizza Eura Casa Luce & Gas?,Quali garanzie offre la polizza Eura Casa Luce & Gas?,Cosa offre la polizza Eura Casa Luce & Gas?,In cosa consiste la polizza Eura Casa Luce & Gas?,Quali servizi mi offre la polizza Eura Casa Luce & Gas?,Cosa garantisce la polizza Eura Casa Luce & Gas?,Quali servizi mi assicuro acquistando la polizza Eura Casa Luce & Gas?,Quale tipo di protezione offre la polizza Eura Casa Luce & Gas?,Quali coperture offre la polizza Eura Casa Luce & Gas?,,,,,,,,,,,,,,,,,,,,La polizza offre la protezione dell'impianto elettrico e a gas della tua casa
56af6c54e0e2eed90800012b,Eura Famiglia,Info e Acquisto,Casa e Famiglia,Cosa offre la polizza Eura Famiglia?,Quali garanzie offre la polizza Eura Famiglia?,Cosa offre la polizza Eura Famiglia?,In cosa consiste la polizza Eura Famiglia?,Quali servizi mi offre la polizza Eura Famiglia?,Cosa garantisce la polizza Eura Famiglia?,Quali servizi mi assicuro acquistando la polizza Eura Famiglia?,Quale tipo di protezione offre la polizza Eura Famiglia?,Quali danni risarcisce la polizza Eura Famiglia?,La polizza Eura Famiglia risarcisce solo i danni causati da un componente del nucleo familiare?,La polizza Eura Famiglia copre anche i danni causati dagli animali domestici?,La polizza Eura Famiglia copre anche i danni causati dagli addetti ai servizi domestici?,,,,,,,,,,,,,,,,,"Eura Famiglia è la polizza Responsabilità Civile della famiglia che risarcisce i danni causati involontariamente a terzi da parte di un componente del nucleo familiare, da un addetto ai servizi domestici oppure da un animale domestico. "
56af6c55e0e2eed90800012e,Eura Famiglia,Info e Acquisto,Casa e Famiglia,Eura Famiglia risarcisce solo i danni causati da un componente del nucleo familiare?,La polizza Eura Famiglia risarcisce solo i danni causati da un componente del nucleo familiare?,,,,,,,,,,,,,,,,,,,,,,,,,,,"Eura Famiglia copre i danni involontariamente causati a terzi da te o da un componente del tuo nucleo familiare, da un addetto ai servizi domestici o dall'animale domestico"
56af6c56e0e2eed908000131,Eura Famiglia,Info e Acquisto,Casa e Famiglia,Eura Famiglia copre solo i danni causati in casa?,La polizza Eura Famiglia copre solo i danni causati in casa?,La polizza Eura Famiglia copre anche i danni causati fuori casa?,"Se acquisto una polizza Eura Famiglia, sono coperto sia dentro casa che fuori?",I danni causati fuori casa sono comunque coperti dalla polizza Eura Famiglia?,,,,,,,,,,,,,,,,,,,,,,,,Eura Famiglia copre i danni involontariamente causati a casa o fuori casa
56af6c58e0e2eed908000134,Domande Generiche,Info e Acquisto,Salute,Cosa offre la polizza Eura Salute Di Più?,Quali garanzie offre la polizza Eura Salute Di Più?,Cosa offre la polizza Eura Salute Di Più?,In cosa consiste la polizza Eura Salute Di Più?,Quali servizi offre la polizza Eura Salute Di più?,Cosa garantisce la polizza Eura Salute Di Più?,Quali servizi mi assicuro acquistando la polizza Eura Salute Di Più?,Quale protezione offre la polizza Eura Salute Di Più?,Quali spese mediche sono coperte dalla polizza Eura Salute Di Più?,Come funziona la polizza Eura Salute Di Più?,Che tipo di coperture garantisce la polizza Eura Salute Di Più?,,,,,,,,,,,,,,,,,,"Eura Salute Di Più offre, in caso di intervento chirurgico o malattia grave, una copertura delle spese mediche proporzionata alla gravità dell'evento"
56af6c58e0e2eed908000137,Domande Generiche,Info e Acquisto,Salute,E' richiesto un questionario sullo stato di salute per sottoscrivere la polizza?,E' richiesto un questionario sullo stato di salute per sottoscrivere la polizza?,Devo compilare un questionario sul mio stato di salute per stipulare la polizza?,Devo attestare il mio stato di salute per poter stipulare la polizza?,Sono richieste informazioni sul mio stato di salute per acquistare la polizza?,,,,,,,,,,,,,,,,,,,,,,,,"Sì, per sottoscrivere la polizza è necessario compilare un breve questionario on-line"
56af6c59e0e2eed90800013a,Domande Generiche,Info e Acquisto,Salute,Esiste un limite di età per sottoscrivere la polizza Eura Salute Di Più?,Qual è il limite di età per sottoscrivere la polizza Eura Salute Di Più?,Esiste un limite di età per sottoscrivere la polizza Eura Salute Di Più?,Fino a quando può essere rinnovata la polizza Eura Salute Di Più?,Quale età si deve avere per sottoscrivere la polizza Eura Salute Di Più?,Posso assicurare una persona di 70 anni con la polizza Eura Salute Di più?,Che età devono avere le persone da assicurare con la polizza Eura Salute Di Più?,Quali sono le condizioni da rispettare per sottoscrivere la polizza Eura Salute Di Più?,Ci sono dei limiti anagrafici per poter sottoscrivere la polizza Eura Salute Di Più?,,,,,,,,,,,,,,,,,,,,"Sì, la polizza può essere sottoscritta fino ai 70 anni, e può rinnovarsi fino a 75 anni"
56af6c5ae0e2eed90800013d,Eura Salute Al mio fianco,Info e Acquisto,Salute,Cosa offre la polizza Eura Salute al Mio Fianco?,Quali garanzie offre la polizza Eura Salute al Mio Fianco?,Cosa offre la polizza Eura Salute al Mio Fianco?,In cosa consiste la polizza Eura Salute al Mio Fianco?,Quali servizi offre la polizza Eura Salute al Mio Fianco?,Cosa garantisce la polizza Eura Salute al Mio Fianco?,Quali servizi mi assicuro acquistando la polizza Eura Salute al Mio Fianco?,Quale protezione offre la polizza Eura Salute al Mio Fianco?,Quali coperture offre la polizza Eura Salute al Mio Fianco?,La polizza Eura Salute al Mio Fianco prevede l'assistenza a domicilio?,In quali casi è attiva la polizza Eura Salute al Mio Fianco?,,,,,,,,,,,,,,,,,,La polizza Eura Salute al Mio Fianco offre assistenza a domicilio quando la malattia o infortunio ti tengono a casa
56af6c5be0e2eed908000140,Eura Salute Al mio fianco,Info e Acquisto,Salute,Esiste un limite di età per sottoscrivere la polizza Eura Salute Al mio fianco?,Qual è il limite di età per sottoscrivere la polizza Eura Salute al Mio Fianco?,Esiste un limite di età per sottoscrivere la polizza Eura Salute Al mio Fianco?,Quale età si deve avere per stipulare la polizza Eura Salute al Mio Fianco?,Che età devono avere le persone da assicurare con la polizza Eura Salute al Mio Fianco?,Fino a quando può essere rinnovata la polizza Eura Salute al Mio Fianco?,Quali sono le condizioni da rispettare per sottoscrivere la polizza Eura Salute al Mio Fianco?,Ci sono dei limiti anagrafici per poter sottoscrivere la polizza Eura Salute al Mio Fianco?,Posso assicurare una persona di 70 anni con la polizza Eura Salute al Mio Fianco?,,,,,,,,,,,,,,,,,,,,"Vale per persone di età non superiore a 75 anni, purché al momento della sottoscrizione della Polizza, non abbiano ancora compiuto i 65 anni di età."
56af6c5ce0e2eed908000143,Eura Salute Subito Protetto,Info e Acquisto,Salute,Cosa offre la polizza Eura Salute Subito Protetto?,Quali garanzie offre la polizza Eura Salute Subito Protetto?,Cosa offre la polizza Eura Salute Subito Protetto?,Cosa garantisce la polizza Eura Salute Subito Protetto?,In cosa consiste la polizza Eura Salute Subito Protetto?,Quali servizi offre la polizza Eura Salute Subito Protetto?,Quali servizi mi assicuto acquistando la polizza Eura Salute Subito Protetto?,Quali coperture garantisce la polizza Eura Salute Subito Protetto?,Come funziona la polizza Eura Salute Subito Protetto?,Quale protezione offre la polizza Eura Salute Subito Protetto? ,Quali infortuni sono coperti dalla polizza Eura Salute Subito Protetto?,In quali situazioni è attiva la polizza Eura Salute Subito Protetto?,La polizza Eura Salute Subito Protetto mi garantisce anche durante le attività sportive?,,,,,,,,,,,,,,,,"Con la polizza Eura Salute Subito Protetto hai la copertura degli infortuni in casa, sul lavoro, nel tempo libero e durante le attività sportive"
56af6c5de0e2eed908000146,Eura Salute Subito Protetto,Info e Acquisto,Salute,Posso coprire le spese mediche dovute ad un infortunio con la polizza Eura Salute Subito Protetto?,Le spese mediche dovute a un infortunio vengono coperte con la polizza Eura Salute Subito Protetto?,Posso coprire le spese mediche dovute a un infortunio con la polizza Eura Salute Subito Protetto?,"In caso di infortunio, le spese mediche sono coperte dalla polizza Eura Salute Subito Protetto?","In caso di infortunio, quale tipo di indennizzo è previsto dalla polizza Eura Salute Subito Protetto?",Ho sibito un infortunio: le spese mediche mi verranno coperte dalla polizza Eura Salute Subito Protetto?,L'indennizzo assicurato dalla polizza Eura Salute Subito Protetto è fisso oppure variabile?,Come viene calcolato l'indennizzo assicurato dalla polizza Eura Salute Subito Protetto in caso di infortunio?,Le spese mediche dovute a un infortunio vengono rimborsate con la polizza Eura Salute Subito Protetto?,La polizza Eura Salute Subito Protetto risarcisce le spese mediche dovute a infortunio?,La polizza Eura Salute Subito Protetto mi copre le spese mediche in caso di infortunio?,,,,,,,,,,,,,,,,,,Con la polizza Eura Salute Subito Protetto hai un indennizzo economico immediato e predefinito sulla base del tipo di infortunio.
56af6c5ee0e2eed908000149,Eura Salute Subito Protetto,Info e Acquisto,Salute,Esiste un limite di età per sottoscrivere la polizza Eura Salute Subito Protetto?,Qual è il limite di età per sottoscrivere la polizza Eura Salute Subito Protetto?,Esiste un limite di età per sottoscrivere la polizza Eura Salute Subito Protetto?,Quale età si deve avere per poter stipulare la polizza Eura Salute Subito Protetto?,Che età devono avere le persone da assicurare con la polizza Eura Salute Subito Protetto?,Per quali persone è valida la polizza Eura Salute Subito Protetto?,Quali sono le condizioni da rispettare per sottoscrivere la polizza Eura Salute Subito Protetto?,Ci sono dei limiti anagrafici per poter sottoscrivere la polizza Eura Salute Subito Protetto?,Posso assicurare una persona di 70 anni con la polizza Eura Salute Subito Protetto?,,,,,,,,,,,,,,,,,,,,Vale per persone di età non superiore a 75 anni
56af6c5fe0e2eed90800014c,Assistenza On Demand Casa,Info e Acquisto,"Viaggi, Auto e Mobilità, Casa e Famiglia, Salute",Cosa offre l'Assistenza On Demand casa di Europ Assistance?,Cosa offre l'Assistenza On Demand Casa?,Quali servizi offre l'Assistenza On Demand Casa?,Quando posso chiamare l'Assistenza On Demand Casa?,Come funziona l'Assistenza On Demand Casa?,Da chi è composta l'Assistenza On Demand Casa?,Posso richiedere l'Assistenza On Demand Casa anche se non ho una polizza Europ Assistance?,Chi può chiedere l'Assistenza On Demand Casa?,Quando è disponibile l'Assistenza On Demand Casa?,Di cosa si occupa l'Assistenza On Demand Casa?,In quali casi posso chiedere l'intervento dell'Assistenza On Demand Casa?,I servizi di Assistenza On Demand Casa sono disponibili anche di notte?,Quali problemi risolve l'Assistenza On Demand Casa?,,,,,,,,,,,,,,,,"L'Assistenza on Demand Casa mette a tua disposizione un network di artigiani specializzati e qualificati, in grado di intervenire tempestivamente, giorno e notte, per aiutarti a risolvere le disavventure domestiche, anche se non hai una polizza."
56af6c60e0e2eed90800014f,Assistenza On Demand Casa,Info e Acquisto,"Viaggi, Auto e Mobilità, Casa e Famiglia, Salute",Quali sono gli artigiani a disposizione dei servizi di Assistenza on Demand Casa?,Quali sono gli artigiani a disposizione dei servizi di Assistenza on Demand Casa?,Quali artigiani sono disponibili per i servizi di Assistenza On Demand Casa?,Quali tipologie di interventi possono essere richiesti grazie all'Assistenza On Demand Casa?,Gli artigiani disponibili per i servizi di Assistenza On Demand Casa che tipo di interventi possono eseguire?,Quali artigiani posso richiedere con l'Assistenza On Demand Casa?,L'Assistenza On Demand Casa su quali artigiani può contare?,,,,,,,,,,,,,,,,,,,,,,"Gli artigiani che possono intervenire anche senza una polizza sono: idraulico, fabbro, elettricista, tapparellista, riparatore di elettrodomestici, vigilante in emergenza, idraulico per il servizio di manutenzione caldaia"
56af6c61e0e2eed908000152,Assistenza On Demand Salute,Info e Acquisto,"Viaggi, Auto e Mobilità, Casa e Famiglia, Salute",Cosa offre l'Assistenza on Demand Salute di Europ Assistance?,Cosa offre l'Assistenza On Demand Salute?,Quali servizi offre l'Assistenza On Demand Salute?,Come funziona l'Assistenza On Demand Salute?,Quando posso chiamare l'Assistenza On Demand Salute?,Quando è disponibile l'Assistenza On Demand Salute?,Di cosa si occupa l'Assistenza On Demand Salute?,Da chi è composta l'Assistenza On Demand Salute?,,,,,,,,,,,,,,,,,,,,,"L'Assistenza on Demand Salute mette a tua disposizione una rete di professionisti specializzati, una Centrale medica sempre operativa, giorno e notte, con costi certi e trasparenti sin da subito."
56af6c62e0e2eed908000155,Assistenza On Demand Salute,Info e Acquisto,"Viaggi, Auto e Mobilità, Casa e Famiglia, Salute",Quali sono i professionisti a disposizione con i servizi di Assistenza on Demand Salute?,Quali sono i professionisti a disposizione dei servizi di Assistenza on Demand Salute?,Quali professionisti sono disponibili con l'Assistenza On Demand Salute?,Quali professionisti posso richiedere con l'Assistenza On Demand Salute?,L'Assistenza On Demand Salute su quali professionisti può contare?,I servizi di Assistenza On Demand Salute sono disponibili a domicilio?,Posso richiedere l'Assistenza On Demand Salute anche se non ho una polizza Europ Assistance?,Chi può chiedere l'Assistenza On Demand Salute?,I servizi di Assistenza On Demand Salute sono disponibili anche di notte?,,,,,,,,,,,,,,,,,,,,"I professionisti che puoi avere a domicilio, a disposizione anche senza una polizza, sono: medico, pediatra, infermiere, fisioterapista, assistente alla persona, operatore socio-sanitario per veglia notturna, badante in emergenza, personale paramedico per trasporto assistito, personale infermieristico per un elettrocardiogramma a domicilio"
56af6c63e0e2eed908000158,Domande Generiche,Info e Acquisto,"Viaggi, Auto e Mobilità, Casa e Famiglia, Salute",Cosa offre l'Assistenza on Demand Mobilità?,Cosa offre l'Assistenza On Demand Mobilità?,Quali servizi offre l'Assistenza On Demand Mobilità?,Come funziona l'Assistenza On Demand Mobilità?,Quando posso chiamare l'Assistenza On Demand Mobilità?,Quando è disponibile l'Assistenza On Demand Mobilità?,Di cosa si occupa l'Assistenza On Demand Mobilità?,L'Assistenza On Demand Mobilità è disponibile anche all'estero?,L'Assistenza On Demand Mobilità interviene anche nei giorni festivi?,Come interviene l'Assistenza On Demand Mobilità?,"In caso di bisogno, l'Assistenza On Demand Mobilità prevede l'invio del carro-attrezzi?",Quali problemi risolve l'Assistenza On Demand Mobilità?,,,,,,,,,,,,,,,,,"Assistenza stradale se resti a piedi con l'auto o la moto, ovunque ti trovi in Italia. In caso di bisogno, ti mandiamo il carro-attrezzi più vicino al luogo del fermo, 24 ore su 24, anche di notte, nel weekend e durante le feste."
56c344b5e0e2ee4c6100051d,Outdoor Noproblem,Info e Acquisto,Viaggi,La polizza Oudoor Noproblem copre i danni a cose o persone causati durante la pratica di uno sport?,La polizza Oudoor Noproblem copre i danni a cose o persone causati durante l'attività sportiva?,La polizza Outdoor Noproblem risarcisce gli eventuali danni a cose o persone causati durante l'attività sportiva?,"Se causo danni durante l'attività sportiva, sono coperto dalla polizza Outdoor Noproblem?",La polizza Outdoor Noproblem include la garanzai Responsabilità Civile verso Terzi?,Con la polizza Outdoor Noproblem sono tutelato riguardo agli eventuali danni causati a terzi?,,,,,,,,,,,,,,,,,,,,,,,"Si, è prevista la garanzia di Responsabilità Civile verso Terzi che tutela da danni creati involontariamente a persone e/o cose"
56c34692e0e2eef6a700056a,Outdoor Noproblem,Info e Acquisto,Viaggi,Con la polizza Outdoor Noproblem è previsto un rimborso per il non utilizzo dell'attrezzatura a noleggio e/o ski pass?,La polizza Outdoor Noproblem prevede un rimborso per il mancato utilizzo dell'attrezzatura a noleggio e/o ski pass?,"Se non utilizzo l'attrezzatura a noleggio e/o skipass, la polizza Outdoor Noproblem mi rimborsa?",L'inutilizzo dell'attrezzatura a noleggio e/o skipass viene rimborsato se si ha la polizza Outdoor Noproblem?,In quali casi il mancato utilizzo dell'attrezzatura a noleggio e/o skipass viene rimborsato da Europ Assistance?,"In caso di infortunio e di conseguente non utilizzo dell'attrezzatura a noleggio e/o skipass, sono previsti rimborsi?",Esiste la possibilità di essere rimborsati se non si utilizza l'attrezzatura a noleggio e/o skipass?,Quali rimborsi garantisce Europ Assistance in caso di infortunio durante l'attività sportiva?,,,,,,,,,,,,,,,,,,,,,"Si, in caso di infortunio procurato durante la pratica sportiva Europ Assistance ti rimborsa ski pass, il noleggio dell'attrezzatura, il costo del soggiorno di cui non hai potuto usufruire e/o l'attrezzatura di proprietà danneggiata"
56c34a8be0e2ee4c61000579,Outdoor Noproblem,Info e Acquisto,Viaggi,"Con la polizza Outdoor Noproblem, in caso di infortunio all'estero c'è la possibilità di essere rimpatriati?",Ho una polizza Outdoor Noproblem: in caso di infortunio all'estero c'è la possibilità di essere rimpatriati?,La polizza Outdoor Noproblem prevede la possibilità di rimpatrio in caso di infortunio all'estero?,"Se subisco un infortunio all'estero, posso essere rimpatriato con la polizza Outdoor Noproblem?",La polizza Outdoor Nopreblem garantisce anche la possibilità di essere rimpatriati in caso di infortunio all'estero?,Con la polizza Outdoor Noproblem posso essere rimpatriato se subisco un infortunio all'estero?,Ho una polizza Outdoor Noproblem e mi sono infortunato durante un viaggio all'estero: mi potete far rientrare in Italia?,,,,,,,,,,,,,,,,,,,,,,"Si, la Centrale Operativa si prenderà cura dell'organizzazione del rientro sanitario"
57237f60e0e2eec593001865,Domande Generiche,"Info e Acquisto, Rimborso Sinistri, Richiesta Assistenza","Viaggi, Auto e Mobilità, Casa e Famiglia, Salute",Come posso diventare un fornitore di Europ Assistance?,Come posso diventare un fornitore di Europ Assistance?,"Vorrei diventare vostro fornitore, come posso fare?",Posso diventare un vostro fornitore?,Esiste la possibilità di diventare fornitori di Europ Assistance?,Sono interessato a diventare un fornitore di Europ Assistance.,Quali istruzioni devo seguire per diventare un vostro fornitore?,A chi devo chiedere per poter diventare un vostro fornitore?,Vorrei candidarmi come fornitore di Europ Assistance.,A chi mi devo rivolgere per poter diventare fornitore di Europ Assistance?,Accettate candidature per divenire vostri fornitori?,Vorrei collaborare con voi come fornitore.,Come posso lavorare con voi?,,,,,,,,,,,,,,,,Puoi inserire la tua candidatura al link www.retefornitori.europassistance.it  compilandolo in ogni sua parte.
574deb9fe0e2eef58600297b,Flexi,Info e Acquisto,"Viaggi, Casa e Famiglia, Salute",Abbonamento Flexi,Come posso acquistare un abbonamento Flexi?,A chi mi devo rivolgere per l'acquisto di un abbonamento Flexi?,Vorrei acquistare un abbonamento Flexi: come faccio?,Quale numero devo chiamare per acquistare un abbonamento Flexi?,Dove si trovano i vostri negozi?,In quali modi posso acquistare un abbonamento Flexi?,Vorrei avere informazioni sull'abbonamento Flexi.,Posso comprare online un abbonamento Flexi?,,,,,,,,,,,,,,,,,,,,Puoi scoprire ed acquistare il nostro abbonamento Flexi:\n\n- Online https://www.europassistance.it/abbonamento/flexi\n\n- Chiamando il numero verde 800.44.33.22\n\n- Recandoti in uno dei nostri negozi https://www.europassistance.it/contatti/orari-negozi
58298d33e0e2ee5895004abe,Domande Generiche,"Info e Acquisto, Rimborso Sinistri, Richiesta Assistenza","Viaggi, Auto e Mobilità, Casa e Famiglia, Salute",Come posso inviare il mio curriculum vitae per lavorare con il vostro gruppo?,Vorrei lavorare in Europ Assistance: come posso fare?,"Vorrei lavorare con voi, come posso fare?",Come posso candidarmi per lavorare o collaborare con voi?,Come posso inoltrare il mio curriculum?,Come posso inviare la mia candidatura?,A chi devo inoltrare la mia candidatura e il mio CV per lavorare con voi?,Dove trovo i vostri annunci di lavoro?,Siete alla ricerca di nuovi collaboratori?,Vorrei inviarvi il mio CV.,Ci sono posizioni aperte per lavorare con voi?,È possibile candidarsi per lavorare in Europ Assistance?,Come posso lavorare con voi?,Come posso inviare il mio CV?,,,,,,,,,,,,,,,Puoi consultare le nostre offerte di lavoro alla pagina Facebook  https://www.facebook.com/EuropAssistanceITCareers o puoi inviare il tuo cv con una email a recruiting@hr.europassistance.it
58298d34e0e2ee5895004ac1,Domande Generiche,"Richiesta Assistenza, Rimborso Sinistri","Viaggi, Auto e Mobilità, Casa e Famiglia, Salute",Come posso chiedere un rimborso?,Come posso denunciare un sinistro e chiedere un rimborso?,Devo chiedere un rimborso per un sinistro. ,Come posso avere un rimborso?,Come devo fare ottenere un rimborso per un sinistro?,Qual è la procedura di rimborso relativa ai sinistri?,Quali istruzioni devo seguire per denunciare un sinistro?,Cosa devo fare per ottenere un rimborso?,Ho bisogno di denunciare un sinistro.,Devo procedere con la denuncia di un sinistro: potete aiutarmi?,Non so come denunciare un sinistro.,Devo aprire un sinistro.,Dove trovo le informazioni riguardanti il rimborso dei sinistri?,Il mio volo è stato cancellato.,Il mio viaggio è stato cancellato.,Il mio volo è in ritardo.,,,,,,,,,,,,,Per denunciare un sinistro puoi collegarti al sito https://sinistrionline.europassistance.it/ e seguire la procedura guidata.
58298d37e0e2ee5895004ac7,Bike Noproblem,Info e Acquisto,Auto e Mobilità,Come posso fare un'assicurazione RC per biciclette?,Come posso fare un'assicurazione RC per biciclette?,Come posso fare un'assicurazione RC per la bici?,Avete un'assicurazione per cicli?,"Vorrei acquistare un'assicurazione RC per la mia bicicletta, come faccio?",Esiste un'assicurazione RC per le biciclette?,Le bici possono essere coperte con un'assicurazione RC?,Quale numero devo chiamare per acquistare un'assicurazione RC per la bicicletta? ,Come si acquista l'assicurazione RC per le biciclette?,In che modo posso acquistare un'assicurazione RC per la mia bici?,È possibile fare un'assicurazione RC a una bicicletta?,Posso acquistare una polizza RC per cicli?,,,,,,,,,,,,,,,,,Per acquistare l'assicurazione RC biciclette vai su https://www.europassistance.it/assicurazioni/auto/bike-noproblem oppure chiama il numero verde 800.44.33.22
58298d38e0e2ee5895004aca,Domande Generiche,Info e Acquisto,"Viaggi, Auto e Mobilità, Casa e Famiglia, Salute",Qual'è l'indirizzo PEC a cui mandare una raccomandata?,Qual è il vostro indirizzo PEC?,Qual è l'indirizzo PEC a cui inviare le raccomandate?,Avete un indirizzo PEC?,Vorrei conoscere il vostro indirizzo PEC.,,,,,,,,,,,,,,,,,,,,,,,,Il nostro indirizzo PEC è EuropAssistanceItaliaSpA@pec.europassistance.it .
58298d3ce0e2ee5895004ad3,Domande Generiche,Richiesta Assistenza,Auto e Mobilità,Quanto costa chiamare un carro attrezzi?,Quanto costa chiamare un carro attrezzi?,Qual è il costo del carro attrezzi?,Qual è la tariffa per la chiamata del carro attrezzi?,Posso avere un preventivo per la chiamata del carro attrezzi?,"Se chiedo il servizio carro attrezzi, quanto spendo?",Vorrei sapere il costo del carro attrezzi.,Quanto costa chiedere l'intervento del carro attrezzi?,Mi fate un preventivo per la chiamata di un carro attrezzi?,,,,,,,,,,,,,,,,,,,,Per ottenere un preventivo di un carro attrezzi a pagamento chiama il numero 803.803
