question_id,category_1,category_2,category_3,question_text_original,question_text_rev,variants_1,variants_2,variants_3,variants_4,variants_5,variants_6,variants_7,variants_8,variants_9,variants_10,variants_11,variants_12,variants_13,variants_14,variants_15,variants_16,variants_17,variants_18,,,,,variants_19,,,,answer
56af6c29e0e2eed90800009e,Domande Generiche,Info e Acquisto,"Viaggi, Auto e Mobilità, Casa e Famiglia, Salute",Quanto tempo ho per acquistare la polizza dal calcolo del preventivo?,Quanto tempo ho per acquistare la polizza dal calcolo del preventivo?,Per quanto tempo il preventivo calcolato rimane bloccato in attesa di essere acquistato?,"Se salvo un preventivo per una polizza, quanto tempo ho a disposizione per decidermi ad completare l'acquisto?",I preventivi non completati per quanto tempo rimangono disponibili nella mia area riservata del sito?,Dal calcolo del preventivo quanto tempo mi rimane per acquistare la polizza?,I preventivi vincolano all'acquisto?,Posso calcolare un preventivo e procedere all'acquisto in un secondo momento?,,,,,,,,,,,,,,,,,,,,,"Il preventivo non è vincolante all'acquisto: se la nostra proposta ti soddisfa, puoi acquistare la polizza quando più ti è comodo, ovviamente con una tempistica ragionevole per la gestione dei documenti che la Compagnia richiede. Il preventivo rimane bloccato per 30 giorni, mentre se hai un preventivo iniziato e non completato la bozza rimane disponibile per due settimane. \n\nÈ buona norma avviare la procedura di acquisto almeno qualche giorno prima della data di decorrenza, ad eccezione delle casistiche nelle quali sia possibile acquistare subito il preventivo con carta di credito o prepagata.\n\nLa polizza Viaggi Nostop Annullamento, a differenza delle altre polizze, deve essere acquistata il giorno stesso o al più tardi entro le 24.00 del giorno successivo conferma della prenotazione/iscrizione al viaggio."
56af6c2ae0e2eed9080000a1,Domande Generiche,Info e Acquisto,Viaggi,Quali sono i requisiti fondamentali per poter stipulare le polizze viaggio?,Quali requisiti fondamentali devo avere per poter stipulare una delle polizze Viaggi?,Esistono dei requisiti per poter sottoscrivere una polizza Viaggi?,Chi può stipulare una polizza Viaggi?,Quali sono le condizioni da rispettare per poter stipulare una polizza Viaggi?,Ci sono limiti di età per sottoscrivere una polizza Viaggi?,Come faccio a sapere se posso stipulare una polizza Viaggi Europ Assistance?,Europ Assistance chiede dei requisiti per poter stipulare una polizza Viaggio?,"Se ho più di 65 anni, posso stipulare una polizza Viaggi?",Qual è il limite di età per poter stipulare una polizza Viaggi?,,,,,,,,,,,,,,,,,,,"I requisiti principali per poter stipulare le polizze viaggio Europ Assistance sono le seguenti:\n- avere una età inferiore ai 75 anni (anche se la polizza mantiene la sua validità nel caso in cui l'assicurato compia tale età in corso di contratto),\n- non essere affetti da alcolismo o tossicodipendenza,\n- non essere un soggetto HIV positivo.\nQualora una o più delle malattie o affezioni sopra richiamate insorgano nel caso del contratto, si applica quanto disposto dall'art 1898 del C.C. indipendentemente dalla concreta valutazione dello stato di salute dell'Assicurato. In caso di dichiarazioni inesatte o reticenti, si applica quanto disposto dagli articoli 1892, 1893, 1894 del C.C.."
56af6c2ae0e2eed9080000a4,Domande Generiche,Info e Acquisto,Viaggi,Le polizze Viaggio Europ Assistance coprono persone che vengono in Italia dall'estero?,Le polizze Viaggio Europ Assistance coprono anche gli stranieri che viaggiano in Italia?,Ci sono delle polizze Viaggio dedicate agli stranieri che viaggiano in Italia?,Esiste una polizza Viaggio che può essere stipulata anche dalle persone che dall'estero vengono in Italia?,Uno straniero che viaggia in Italia può sottoscrivere una polizza Viaggio Europ Assistance?,Quali polizze Viaggio possono stipulare gli stranieri che viaggiano in Italia?,La polizza Medico Nostop Italy è disponibile anche per gli stranieri che vengono in Italia?,Gli stranieri che viaggiano in Italia possono assicurarsi con una polizza Viaggio?,Europ Assistance assicura anche gli stranieri che viaggiano in Italia?,Quali garanzie offre Europ Assistance alle persone che dall'estero vengono in Italia?,,,,,,,,,,,,,,,,,,,"Si, per gli stranieri che viaggiano in Italia è disponibile la polizza Medico Nostop Italy, che comprende assistenza sanitaria 24 ore su 24 in caso di infortuno o malattia e il rimborso delle spese mediche, farmaceutiche o ospedaliere sostenute in caso di cure non rimandabili."
56af6c2be0e2eed9080000a7,Domande Generiche,Info e Acquisto,"Viaggi, Auto e Mobilità, Casa e Famiglia, Salute","Sono cittadino della Repubblica di San Marino, posso stipulare la polizza?","Sono cittadino della Repubblica di San Marino, posso stipulare una polizza?",I cittadini della Repubblica di San Marino possono stipulare le polizze Europ Assistance?,"Se sono cittadino sanmarinese, posso sottoscrivere la polizza?","La mia residenza è nella Repubblica di San Marino, posso comunque sottoscrivere la polizza?",,,,,,,,,,,,,,,,,,,,,,,,"Si. L'assicurato, per le polizze Viaggio Europ Assistance, è una persona fisica che deve avere la residenza in Italia, Repubblica di San Marino o Città del Vaticano."
56af6c2ce0e2eed9080000aa,Domande Generiche,Info e Acquisto,"Viaggi, Auto e Mobilità, Casa e Famiglia, Salute","Non ho residenza italiana ma sono domiciliato in Italia, posso acquistare comunque la polizza assicurativa?","Il mio domicilio è in Italia, ma la mia residenza è all'estero: posso comunque stipulare una polizza Europ Assistance?","Non ho residenza italiana ma sono domiciliato in Italia, posso acquistare comunque la polizza assicurativa?",Quali polizze possono essere stupulate da chi è domiciliato ma non residente in Italia?,"La mia residenza è all'estero, ma il mio domicilio è in Italia: posso sottoscrivere una polizza assicurativa?",Esistono polizze dedicate a chi ha il domicilio in Italia pur non avendo la residenza italiana?,"Ho il domicilio in Italia, ma la mia residenza è all'estero e bisogno di una polizza assicurativa.",,,,,,,,,,,,,,,,,,,,,,"Anche per le persone domiciliate ma non residenti in Italia è disponibile la polizza Medico Nostop Italy, che comprende assistenza sanitaria 24 ore su 24 in caso di infortuno o malattia e il rimborso delle spese mediche, farmaceutiche o ospedaliere sostenute in caso di cure non rimandabili."
56af6c2ee0e2eed9080000b0,Domande Generiche,Info e Acquisto,"Viaggi, Auto e Mobilità, Casa e Famiglia, Salute",L'assicurazione copre le persone in stato di gravidanza?,L'assicurazione copre le persone in stato di gravidanza?,,,,,,,,,,,,,,,,,,,,,,,,,,,"Si, le assicurazioni viaggi Europ Assistance coprono malattie e infortuni che insorgono a seguito di gravidanza (entro la 26° settimana di gestazione) ma la gravidanza non è considerata di per sé una malattia, pertanto non sono coperti esami particolari, ecografie ecc. a meno che non insorga la loro necessità a seguito di malattia o infortunio."
56af6c2fe0e2eed9080000b3,Domande Generiche,Info e Acquisto,Viaggi,"Ho più di 65 anni, posso acquistare l'assicurazione viaggio?","Se ho più di 65 anni, posso stipulare una polizza Viaggi?",,,,,,,,,,,,,,,,,,,,,,,,,,,"Si. Per le polizze viaggio, relativamente alla garanzia Infortuni in Viaggio, l'Assicurazione vale per persone di età non superiore a 75 anni. Tuttavia, per le persone che compiono questa età in corso di contratto, la garanzia mantiene la sua validità fino alla scadenza della Polizza."
56af6c30e0e2eed9080000b6,Domande Generiche,Info e Acquisto,Viaggi,Entro quanto tempo posso acquistare la polizza prima della partenza per il mio viaggio?,Entro quanto tempo posso acquistare la polizza prima della partenza per il mio viaggio?,Qual è il tempo limite per acquistare una polizza Viaggi Nostop prima della partenza del viaggio?,Posso sottoscrivere la polizza il giorno prima della partenza?,Quali tempistche devo rispettare per acquistare una polizza Viaggi Nostop?,Quanto tempo ho a disposizione per acquistare una polizza per il mio viaggio?,Quanto posso aspettare per acquistare una polizza per il mio viaggio?,"Prima di partire per il mio viaggio, quanto tempo ho a disposizione per acquistare una polizza Viaggi Nostop?","Domani parto per il mio viaggio, posso acquistare una polizza Viaggi Nostop?",Tra una settimana è fissata la partenza del mio viaggio: entro quando posso acquistare una polizza Viaggio?,,,,,,,,,,,,,,,,,,,"Le polizze Viaggi Nostop possono essere acquistate fino al giorno prima della partenza, in quanto l'emissione del certificato assicurativo è immediata e verrà inviata, entro pochi minuti dall'acquisto, all'indirizzo e-mail da te indicato"
56af6c31e0e2eed9080000b9,Domande Generiche,Info e Acquisto,Viaggi,"Non ho acquistato un viaggio organizzato tramite Agenzia di Viaggio o Tour Operator, posso assicurarmi?","Non ho acquistato un viaggio organizzato tramite Agenzia di Viaggio o Tour Operator, posso comunque acquistare una polizza Viaggi?",Posso acquistare una polizza Viaggio anche se il mio viaggio non è organizzato da Agenzia o un Tour Operator?,Assicurate anche viaggi non organizzati da Agenzia o Tour Operator?,I viaggi non organizzati da Agenzia di Viaggio o Tour Operator possono essere assicurati?,Il mio viaggio non è organizzato né da un'Agenzia né da un Tour Operator: posso comunque acquistare una polizza?,,,,,,,,,,,,,,,,,,,,,,,"Si, le assicurazioni Viaggio Europ Assistance possono essere acquistate anche se il viaggio non è stato organizzato tramite Agenzia di Viaggio o Tour Operator."
56af6c32e0e2eed9080000bc,Domande Generiche,Info e Acquisto,Viaggi,"Ho acquistato un biglietto aereo con una data di rientro flessibile, che date devo inserire in polizza?",Ho acquistato un biglietto aereo con una data di rientro flessibile: quali date che date devo inserire all'interno della polizza Viaggi?,Come gestisco le date da inserire nella polizza Viaggi se ho acquistato un biglietto aereo con data di rientro flessibile?,"Se scelgo un biglietto aereo con data di rientro flessible, quali date devo specificare nella polizza Viaggi?",Quale data di rientro devo inserire nella polizza se ho comprato un biglietto aereo con data di rientro flessibile?,,,,,,,,,,,,,,,,,,,,,,,,"In questo caso, come date di viaggio, dovrai inserire quelle riportate sul biglietto di viaggio, considerando la data nella quale arriverai o atterrerai in Italia."
56af6c32e0e2eed9080000bf,Domande Generiche,Info e Acquisto,Viaggi,Posso effettuare l'acquisto di una polizza Viaggi Europ Assistance dopo la data di inizio del viaggio?,Posso acquistare una polizza Viaggi Europ Assistance dopo la data di inizio del viaggio?,Posso stipulare una polizza a viaggio iniziato?,Posso acquistare una polizza Viaggi Nostop anche dopo che il viaggio è iniziato?,È possibile acquistare una polizza successivamente alla partenza del viaggio?,"Ieri sono partito per la mia vacanza, posso stipulare anche adesso una polizza Viaggi?","Sono in viaggio e vorrei sottoscrivere una polizza, è possibile?","Dopo che il viaggio è iniziato, è comunque possibile acquistare una polizza Viaggi?",,,,,,,,,,,,,,,,,,,,,"No, non è possibile stipulare una polizza Viaggi Europ Assistance a viaggio iniziato."
56af6c34e0e2eed9080000c2,Domande Generiche,Info e Acquisto,Viaggi,Su quali ambiti sono coperto con un'assicurazione viaggio?,Quali ambiti copre una polizza Viaggi di Europ Assistance?,Che cosa copre la polizza Viaggi?,Su quali ambiti sono coperto con un'assicurazione viaggio?,Quali sono le aree di copertura delle polizze Viaggi?,Quali prodotti offre Europ Assistance per le assicurazioni viaggio?,Quali tipologie di polizze Viaggi offre Europ Assistance?,Tra quali coperture posso scegliere con le polizze Viaggi di Europ Assistance?,Quali garanzie posso ottenere con una polizza Viaggi?,Quali servizi mi garantiscono le polizze Viaggi di Europ Assistance?,,,,,,,,,,,,,,,,,,,"Le aree di copertura delle polizze EA sono diverse e dipendono in larga misura dal prodotto assicurativo selezionato.\n\nUna polizza Viaggi Nostop Vacanza di Europ Assistance, ad esempio, ti garantisce:\n-  Assistenza sanitaria in tutto il mondo per risolvere qualunque emergenza, dalla segnalazione di un medico di riferimento all'estero fino al costante monitoraggio della degenza ospedaliera, inclusa l'organizzazione del rientro in Italia con accompagnamento sanitario. Il tutto grazie a una Centrale Operativa attiva 24 ore su 24,\n- Copertura spese mediche, ospedaliere e farmaceutiche in caso di malattia o infortunio, con pagamento diretto presso le strutture ospedaliere o rimborso nei caso in cui non fosse possibile il pagamento diretto.\n- Protezione del bagaglio e degli effetti personali, inclusi i vestiti indossati in caso di furto e incendio o disguidi con il vettore. E con l'estensione alla garanzia Bagaglio Top puoi estendere la protezione  a cellulari, mp3, personal computer, tablet, passeggini, carrozzine e attrezzatura sportiva.\n\nUna Polizza Viaggi Nostop Visti, necessaria per ottenere il Visto di ingresso nei paesi che richiedono l'assicurazione medica obbligatoria, garantisce invece assistenza sanitaria all'estero, pagamento delle spese mediche e copertura bagaglio per i viaggi, a scopo turistico o di studio, fino a 60 giorni in Russia, Algeria, Cuba e Libia.\n\nAncora, una polizza Viaggi Nostop Annullamento ti garantisce totale copertura assicurativa nel caso in cui  un imprevisto dovesse costringere te o la tua famiglia ad annullare o riprogrammare un viaggio. In quest'ultimo caso, l'assicurazione Viaggi Nostop Annullamento copre il rimborso degli eventuali maggiori costi sostenuti per l'acquisto di nuovi biglietti al posto di quelli non utilizzati.\n\nUna polizza Viaggi Nostop Gruppi, invece, pensata per i gruppi di almeno 10 persone, garantisce assistenza sanitaria 24 ore su 24 in tutto il mondo (consulenza medica, invio di un medico o di un'autoambulanza, rientro anticipato o segnalazione di uno specialista all'estero). Copre il rimborso delle spese mediche, farmaceutiche, ospedaliere in caso di infortunio o malattia e copre anche il bagaglio e gli effetti personali in caso di furto o smarrimento. È inoltre possibile acquistare garanzie integrative relative ad infortuni in viaggio, responsabilità civile e tutela legale.\nQuesti sono solo alcuni esempi riguardo le tipologie di copertura che le polizze viaggi Europ Assistance offrono, per maggiori informazioni ti invitiamo a consultare il fascicolo informativo del prodotto assicurativo di tuo interesse."
56af6c40e0e2eed9080000e9,Domande Generiche,Info e Acquisto,"Viaggi, Auto e Mobilità, Casa e Famiglia, Salute",Cosa devo fare se non riesco a calcolare correttamente un preventivo online?,Non riesco a calcolare correttamente un preventivo online,Non riesco a calcolare un preventivo onine.,Ho problemi nel calcolo di un preventivo online.,Quali sono le istruzioni per calcolare un preventivo online?,Non riesco a calcolare un preventivo online: potete aiutarmi?,,,,,,,,,,,,,,,,,,,,,,,"Ricontrolla che le tue risposte alle domande presenti nel processo di calcolo del preventivo siano corrette e complete: alla sinistra di ciascuna domanda, passando con il mouse sul simbolo (i), otterrai informazioni più dettagliate e puntuali sul tipo di dati da fornire in quella specifica domanda. In alternativa, se non riesci comunque a portare a termine il tuo preventivo su internet, puoi ottenere un preventivo telefonico contattandoci al numero 800.44.33.22, attivo dalle 08.00 alle 20.00 dal lunedì al sabato."
56af6c44e0e2eed9080000f8,Viaggi Nostop Treseicinque,Info e Acquisto,Viaggi,Sono coperto anche se cambio paese durante la permanenza all'estero?,Sono coperto anche se cambio paese durante la permanenza all'estero?,La copertura assicurativa è valida anche se cambio paese mentre sono all'estero?,La copertura delle polizze Viaggi è mondiale?,Sono in viaggio all'estero e cambio paese: la mia copertura rimane attiva?,"Se decido di cambiare paese durante la permanenza all'estero, mantenfo comunque la copertura assicurativa?",Vorrei cambiare paese durante un viaggio all'estero: la mia polizza Viaggi rimane comunque valida?,"La mia polizza Viaggi è sempre valida, in qualunque paese io vada?",La mia polizza Viaggi mi copre a prescindere dal fatto che io cambi paese durante un viaggio all'estero?,,,,,,,,,,,,,,,,,,,,"Si, la copertura è mondiale."
56af6c45e0e2eed9080000fb,Viaggi Nostop Treseicinque,Info e Acquisto,Viaggi,C'è un limite di età per sottoscrivere la Viaggi Nostop Vacanza TreSeiCinque?,Qual è il limite di età per sottoscrivere la polizza Viaggi Nostop Vacanza TreSeiCinque?,Esiste un limite di età per stipulare una polizza Viaggi Nostop TreSeiCinque?,Se ho 75 anni posso stipulare una polizza Viaggi Nostop Vacanza TreSeiCinque?,Fino a quale età posso acquistare una polizza Viaggi Nostop TreSeiCinque?,Quale età devo avere per poter sottoscrivere una polizza Viaggi Nostop Vacanza TreSeiCinque?,,,,,,,,,,,,,,,,,,,,,,,La persona assicurata non deve superare l'età di 70 anni.
56af6c46e0e2eed9080000fe,Viaggi Nostop Stage,Info e Acquisto,Viaggi,Quali sono i casi in cui conviene acquistare una Viaggi Nostop Stage?,Quando è conveniente acquistare una polizza Viaggi Nostop Stage?,Quali sono i casi in cui conviene acquistare una Viaggi Nostop Stage?,Per chi è pensata la polizza Viaggi Nostop Stage?,Per chi è consigliabile scegliere la polizza Viaggi Nostop Stage?,,,,,,,,,,,,,,,,,,,,,,,,Quando si viaggia per uno stage all'estero o motivi di studio.
56af6c47e0e2eed908000101,Viaggi Nostop Stage,Info e Acquisto,Viaggi,Qual è la durata massima della Viaggi Nostop Stage?,Qual è la durata massima della polizza Viaggi Nostop Stage?,Quanti mesi copre la polizza Viaggi Nostop Stage?,Per quanto tempo posso essere assicurato con la polizza Viaggi Nostop Stage?,Qual è il periodo di validità della polizza Viaggi Nostop Stage?,Quanto tempo dura la polizza Viaggi Nostop Stage?,,,,,,,,,,,,,,,,,,,,,,,La copertura assicurativa è valida per 6 mesi
56af6c48e0e2eed908000104,Viaggi Nostop Stage,Info e Acquisto,Viaggi,Ci sono limiti di età per stipulare una Viaggi Nostop Stage?,Qual è il limite di età per stipulare una polizza Viaggi Nostop Stage?,Esiste un limite di età per stipulare una polizza Viaggi Nostop Stage?,Se ho 30 anni posso stipulare una polizza Viaggi Nostop Stage?,Fino a quale età posso acquistare una polizza Viaggi Nostop Stage?,Quali sono i requisiti per stipulare una polizza Viaggi Nostop Stage?,Quale età devo avere per poter sottoscrivere una polizza Viaggi Nostop Stage?,,,,,,,,,,,,,,,,,,,,,,La polizza è valida per i giovani di età compresa tra i 18 e i 35 anni
56af6c49e0e2eed908000107,Viaggi Nostop Gruppi,Info e Acquisto,Viaggi,Quando è possibile stipulare la polizza Viaggi Nostop Gruppi?,Quali garanzie offre la polizza Viaggi Nostop Gruppi e qual'è il numero minimo di persone da assicurare?,Quando è possibile stipulare la polizza Viaggi Nostop Gruppi?,Quali coperture offre la polizza Viaggi Nostop Gruppi?,In quali casi sono coperto dalla polizza Viaggi Nostop Gruppi?,Quali sono le condizioni da rispettare per poter stipulare la polizza Viaggi Nostop Gruppi?,In cosa consiste la polizza Viaggi Nostop Gruppi?,La polizza Viaggi Nostop Gruppi garantisce assistenza medico-sanitaria?,La polizza Viaggi Nostop Gruppi garantisce anche il bagaglio e gli effetti personali?,Quanto deve essere numeroso un gruppo per poter sottoscrivere una polizza Viaggi Nostop Gruppi?,Da quante persone deve essere formato un gruppo  per essere assicurabile con la polizza Viaggi Nostop Gruppi?,,,,,,,,,,,,,,,,,,"La polizza Viaggi Nostop Gruppi garantisce assistenza sanitaria in tutto il mondo 24 ore su 24 e copre anche il bagaglio o gli effetti personali in caso di furto o smarrimento, può essere stipulata quando i viaggiatori da assicurare sono almeno in 10 ed il viaggio ha una durata massima di 30 giorni."
56af6c4ae0e2eed90800010a,Viaggi Nostop Gruppi,Info e Acquisto,Viaggi,Qual è il numero minimo di persone da assicurare per la polizza Viaggi Nostop Gruppi?,Qual è il numero minimo di persone da assicurare per la polizza Viaggi Nostop Gruppi?,,,,,,,,,,,,,,,,,,,,,,,,,,,Da dieci in su.
56af6c4be0e2eed90800010d,Viaggi Nostop Lavoro,Info e Acquisto,Viaggi,Quali sono i casi in cui conviene acquistare una Viaggi Nostop Lavoro?,Quando è conveniente stipulare la polizza Viaggi Nostop Lavoro?,Quali sono i casi in cui conviene acquistare una Viaggi Nostop Lavoro?,Per chi è pensata la polizza Viaggi Nostop Lavoro?,Per chi è consigliabile scegliere la polizza Viaggi Nostop Lavoro?,,,,,,,,,,,,,,,,,,,,,,,,"Quando si viaggia per motivi di lavoro, sia per viaggi di breve durata che per trasferimenti temporanei all'estero"
56af6c4ce0e2eed908000110,Viaggi Nostop Lavoro,Info e Acquisto,"Viaggi, Auto e Mobilità, Casa e Famiglia, Salute",Il contraente della polizza deve essere per forza un'azienda?,Il contraente della polizza Viaggi Nostop Lavoro deve essere per necessariamente un'azienda?,Sole un'azienda può sottoscrivere la polizza Viaggi Nostop Lavoro?,La polizza Viaggi Nostop Lavoro è pensata soltanto per le aziende?,,,,,,,,,,,,,,,,,,,,,,,,,"No, può essere anche un contraente individuale fornendo il codice fiscale"
56af6c4de0e2eed908000113,Viaggi Nostop Lavoro,Info e Acquisto,Viaggi,Qual è il numero minimo di persone da assicurare per la polizza Viaggi Nostop Lavoro?,Quante persone possono essere assicurate con la polizza Viaggi Nostop Lavoro?,Esiste un numero minimo di persone assicurabili con la polizza Viaggi Nostop Lavoro?,Qual è il numero minimo di persone da assicurare per la polizza Viaggi Nostop Lavoro?,Qual è il numero massimo di persone per cui può essere stipulata la polizza Viaggi Nostop Lavoro?,La polizza Viaggi Nostop Lavoro può essere stipulata per più persone?,,,,,,,,,,,,,,,,,,,,,,,Da 1 a 9
56af6c4ee0e2eed908000116,Outdoor Noproblem,Info e Acquisto,Viaggi,Cosa offre la polizza Outdoor Noproblem?,Quali garanzie offre la polizza Outdoor Noproblem?,Cosa garantisce la polizza Outdoor Noproblem?,In cosa consiste la polizza Outdoor Noproblem?,Quali servizi mi offre la polizza Outdoor Noproblem?,Quali servizi mi assicuro acquistando la polizza Outdoor Noproblem?,Quale tipo di protezione offre la polizza Outdoor Noproblem?,In quali luoghi è valida la polizza Outdoor Noproblem?,,,,,,,,,,,,,,,,,,,,,"Outdoor Noproblem è la polizza che garantisce protezione durante la pratica dell'attività outdoor in qualsiasi stagione, ovunque ti trovi."
56af6c4ee0e2eed908000119,Outdoor Noproblem,Info e Acquisto,Viaggi,Outdoor Noproblem copre le spese mediche per ricerca e soccorso?,La polizza Outdoor Noproblem garantisce le spese mediche per ricerca e soccorso?,Le spese mediche per ricerca e soccorso sono coperte dalla polizza Outdoor Noproblem?,Le spese per ricerca e soccorso vengono rimborsate da Europ Assistance?,Come vengono gestite le spese mediche per ricerca e soccorso per la polizza Outdoor Noproblem?,Per la polizza Outdoor Noproblem è prevista la copertura delle spese mediche per ricerca e soccorso?,"Se ho la polizza Outdoor Noproblem, sono assicurato anche per le spese mediche per ricerca e soccorso?",Ho una polizza Outdoor Noproblem: mi garantite il rimborso delle spese mediche per ricerca e soccorso?,,,,,,,,,,,,,,,,,,,,,"Europ Assistance provvederà al rimborso delle spese, nel limite del massimale, per la ricerca, salvataggio e/o recupero, anche con l'ausilio di elicottero, sia tentato che compiuto."
56af6c4fe0e2eed90800011c,Outdoor Noproblem,Info e Acquisto,Viaggi,In che formule posso acquistare Outdoor Noproblem?,Quali sono le formule in cui può essere acquistata la polizza Outdoor Noproblem?,In quali formule è disponibile la polizza Outdoor Noproblem?,Quale durata può avere la polizza Outdoor Noproblem?,Quanto dura la polizza Outdoor Noproblem?,Posso acquistare la polizza Outdoor Noproblem solo per una settimana?,Esistono diverse tipologie di polizze Outdoor Noproblem?,,,,,,,,,,,,,,,,,,,,,,"Outdoor Noproblem è presente in tre formule: settimanale, annuale e 36 mesi."
56af6c50e0e2eed90800011f,Outdoor Noproblem,Info e Acquisto,Viaggi,Quali sono le modalità di pagamento per la formula 36 mesi di Outdoor Noproblem?,Quali sono le modalità di pagamento per la formula 36 mesi di Outdoor Noproblem?,Come può essere acquistata la formula 36 mesi della polizza Outdoor Noproblem?,Vorrei acquistare  la formula 36 mesi della polizza Outdoor Noproblem: come posso fare?,La formula 36 mesi della polizza Outdoor Noproblem quali metodi di pagamento prevede?,,,,,,,,,,,,,,,,,,,,,,,,La formula 36 mesi può essere acquistata con addebito diretto su carta di credito mensilmente.
56af6c51e0e2eed908000122,Infortuni In Volo,Info e Acquisto,Viaggi,Quali sono i casi in cui conviene acquistare una Viaggi Nostop vacanza Infortuni in Volo?,Quando è conveniente acquistare una polizza Viaggi Nostop Vacanza Infortuni in Volo?,Quali sono i casi in cui conviene acquistare una Viaggi Nostop Vacanza Infortuni in Volo?,Per chi è pensata la polizza Viaggi Nostop Vacanza Infortuni in Volo?,Per chi è consigliabile scegliere la polizza Viaggi Nostop Vacanza Infortuni in Volo? ,Quale copertura offre la polizza Viaggi Nostop Vacanza Infortuni in Volo?,,,,,,,,,,,,,,,,,,,,,,,In caso di viaggio aereo per proteggersi da un infortunio occorso durante il volo.
