question_id,category_1,category_2,category_3,question_text_original,question_text_rev,variants_1,variants_2,variants_3,variants_4,variants_5,variants_6,variants_7,variants_8,variants_9,variants_10,variants_11,variants_12,variants_13,variants_14,variants_15,variants_16,variants_17,variants_18,,,,,variants_19,,,,answer
56af6bb2e0e2eee2aa000025,Viaggi Nostop Vacanza,Info e Acquisto,Viaggi,"Ho sottoscritto la Polizza Viaggi Nostop Annuale e vorrei disdirla, come posso procedere?",Come faccio a disdire la polizza Viaggi Nostop Annuale?,Come ottenere la disdetta della Polizza Nostop Annuale?,Quali sono le istruzioni da seguire per disdire la polizza Viaggi Nostop Annuale?,Come comunicare la disdetta della polizza Viaggi Nostop Annuale?,Come posso inviare la disdetta della polizza Viaggi Nostop Annuale?,Quali sono le modalità per disdire la mia polizza Viaggi Nostop Annuale?,,,,,,,,,,,,,,,,,,,,,,"Puoi inviare richiesta di disdetta della polizza con lettera raccomandata indirizzata a Europ Assistance Spa – Piazza Trento 8, 20135 Milano almeno 30 giorni prima della data di scadenza. In alternativa puoi inviare richiesta anche via fax al numero 02.58.47.70.34 o via email all'indirizzo servizio.clienti@europassistance.it"
56af6bb7e0e2eee2aa000031,Viaggi Nostop Vacanza,Richiesta Assistenza,Viaggi,Sono in possesso di una polizza Viaggi Nostop Vacanza: come devo procedere per ottenere la prestazione Assistenza Domiciliare Integrata?,"Ho una polizza Viaggi Nostop Vacanza, come posso ottenere l'assistenza domicialiare integrata?","Se ho sottoscritto la polizza Viaggi Nostop Vacanza, come posso ottenere il servizio di assistenza domiciliare integrata?",Sono in possesso di una polizza Viaggi Nostop Vacanza: come devo procedere per ottenere la prestazione assistenza domiciliare integrata?,,,,,,,,,,,,,,,,,,,,,,,,,"Per la prestazione Assistenza Domiciliare Integrata in caso di sinistro dovrai prendere contatto con la Struttura Organizzativa almeno 48 ore prima delle previste dimissioni dall'Istituto di Cura, chiamando il numero di telefono 02.58.28.69.82 e inviando via fax al numero 02.58.38.45.78 l'opportuna certificazione medica con prescrizione dell'assistenza domiciliare.\nPer qualunque informazione aggiuntiva ti invitiamo a consultare il fascicolo informativo relativo al prodotto o contattarci al numero verde 800.44.33.22."
56af6bb8e0e2eee2aa000034,Viaggi Nostop Vacanza,Info e Acquisto,Viaggi,Quando è conveniente stipulare la formula annuale Multiviaggio?,Quali sono le condizioni della polizza Multiviaggio?,Per chi è pensata la polizza Multiviaggio?,Quando è conveniente stipulare la polizza Viaggi Nostop Annuale Multiviaggio?,Per chi è consigliabile scegliere la formula Multiviaggio,La polizza Viaggi Nostop Annuale Multiviaggio copre anche i viaggi di lavoro?,,,,,,,,,,,,,,,,,,,,,,,"La formula Multiviaggio è indicata per tutti coloro che hanno in programma di compiere più viaggi nell'arco dell'anno, purchè ogni singolo viaggio non superi i 90 giorni consecutivi. Sono coperti i viaggi effettuati sia a scopo turistico, che di studio o per lo svolgimento di attività professionali non pericolose."
56af6bb9e0e2eee2aa000037,Viaggi Nostop Vacanza,Info e Acquisto,Viaggi,La polizza Viaggi Nostop Annuale Multiviaggio prevede il rinnovo automatico?,Come si rinnova la polizza  Viaggi Nostop Annuale Multiviaggio?,La polizza Viaggi Nostop Annuale Multiviaggio prevede il rinnovo automatico?,Come funziona il rinnovo della polizza Nostop Annuale Multiviaggio?,Quali sono le modalità di rinnovo della formula Multiviaggio?,Come faccio a rinnovare la polizza Viaggi Nostop Annuale Multiviaggio?,,,,,,,,,,,,,,,,,,,,,,,"Sì, la polizza in versione Annuale Multiviaggio si rinnova tacitamente alla scadenza. Se non intendi rinnovarla, puoi inviare richiesta di disdetta della polizza con lettera raccomandata indirizzata a Europ Assistance Spa – Piazza Trento 8, 20135 Milano almeno 30 giorni prima della data di scadenza. In alternativa puoi inviare richiesta anche via fax al numero 02.58.47.70.34 o via email all'indirizzo servizio.clienti@europassistance.it"
56af6bbae0e2eee2aa00003a,Viaggi Nostop Vacanza,Info e Acquisto,Viaggi,Le indennità ed i rimborsi per la polizza Viaggi Nostop Vacanza in che valuta vengono corrisposti?,Qual è la valuta con cui vengono corrisposti i rimborsi e le indennità previste dalla polizza Viaggi Nostop Vacanza?,In quale valute verranno emessi i rimborsi previsti dalla polizza Viaggi Nostop Vacanza?,"In caso di viaggio fuori dall'Unione Europea, come verrà calcolato il rimborso per la polizza Viaggi Nostop Vacanza?",In caso di viaggio all'estero in quale valuta mi verrà corrisposto il rimborso per la polizza Viaggi Nostop Vacanza?,,,,,,,,,,,,,,,,,,,,,,,,"In Euro. Nel caso di spese sostenute in Paesi non appartenenti all'Unione Europea o appartenenti alla stessa ma che non abbiano adottato l'Euro come valuta, il rimborso verrà calcolato al cambio rilevato dalla Banca Centrale Europea relativo al giorno in cui l'assicurato ha sostenuto le spese."
56af6bbbe0e2eee2aa00003d,Viaggi Nostop Vacanza,Rimborso Sinistri,Viaggi,Ho una polizza Viaggi Nostop Vacanza e devo chiedere un rimborso: ci sono delle franchigie o degli scoperti sulle spese mediche che ho sostenuto?,La polizza Viaggi Nostop Vacanza prevede una franchigia?,Ho una polizza Viaggi Nostop Vacanza e devo chiedere un rimborso: ci sono delle franchigie o degli scoperti sulle spese mediche che ho sostenuto?,Quale tipo di franchigia prevede la polizza Viaggi Nostop Vacanza?,Qual è la franchigia della polizza Viaggi Nostop Vacanza?,,,,,,,,,,,,,,,,,,,,,,,,"Il rimborso viene effettuato, per ogni sinistro, applicando una franchigia fissa e assoluta di € 50,00."
56af6bbce0e2eee2aa000040,Viaggi Nostop Vacanza,Richiesta Assistenza,Viaggi,Come interviene Europ Assistance in caso di necessità di spese mediche?,Come interviene Europ Assistance in caso di necessità di spese mediche durante un viaggio?,Come si deve agire in caso di necessità di urgenti spese mediche nel corso di una vacanza?,A chi mi devo rivolgere in caso di necessità di spese mediche?,,,,,,,,,,,,,,,,,,,,,,,,,"Se in seguito ad una malattia improvvisa o un'infortunio avvenuti nel corso del viaggio, hai necessità di sostenere sul posto delle spese per cure o interventi chirurgici urgenti e non procrastinabili, dovrai contattare la Centrale Operativa che provvederà a prendere in carico le spese. Nei casi in cui non fosse possibile effettuare il pagamento diretto, le spese saranno rimborsate in seguito all'invio della documentazione attestante il pagamento solo se preventivamente autorizzate dalla Centrale Operativa."
56af6bbde0e2eee2aa000043,Viaggi Nostop Vacanza,Rimborso Sinistri,Viaggi,"Mi rimborsate solo le spese mediche sostenute in viaggio, oppure anche quelle sostenute dopo il rientro?",Il rimborso delle spese mediche include anche quelle sostenute dopo il rientro dal viaggio?,"Mi rimborsate solo le spese mediche sostenute in viaggio, oppure anche quelle sostenute dopo il rientro?",Rimborsate anche le spese mediche sostenute al rientro dal viaggio?,Come funziona il rimborso delle spese mediche?,Qual è la procedura di rimborso relativa alle spese mediche?,,,,,,,,,,,,,,,,,,,,,,,"Solo in caso di infortunio sono comprese in garanzia anche le ulteriori spese per le cure ricevute dopo il rientro al luogo di residenza, purché effettuate nei 45 giorni successivi all'infortunio stesso. Negli altri casi la garanzia copre solo le spese sostenute in viaggio."
56af6bbde0e2eee2aa000046,Viaggi Nostop Vacanza,Info e Acquisto,Viaggi,"Ho una polizza Viaggi Nostop Vacanza: nel caso di infortunio, esiste un'indennità che mi risarcisce?",Ho una polizza Viaggi Nostop Vacanza: in caso di infortunio è previsto un rimborso?,Nella polizza Viaggi Nostop Vacanza sarò risarcito in caso di infortunio?,Come posso fare per essere risarcito in caso di infortunio nel corso del viaggio?,Esiste una copertura per gli eventuali infortuni occorsi durante il viaggio?,La polizza Viaggi Nostop Vacanza risarcisce gli infortuni subiti nel corso del viaggio?,,,,,,,,,,,,,,,,,,,,,,,"Si, se hai sottoscritto l'integrazione infortuni in viaggio collegata al pacchetto base della Viaggi Nostop Vacanza. L'integrazione Infortuni in Viaggio è acquistabile solo nella soluzione per viaggi di breve durata."
56af6bbee0e2eee2aa000049,Viaggi Nostop Vacanza,Info e Acquisto,Viaggi,Cosa copre la garanzia Infortuni in Viaggio?,"Cosa copre la garanzia ""Infortuni in Viaggio""?","Quali sono le condizioni della garanzia ""Infortuni in Viaggio""?","Quali sono le limitazioni della garanzia ""Infortuni in Viaggio""?","Come funziona la garanzia ""Infortuni in Viaggio""?","In cosa consiste la garanzia ""Infortuni in Viaggio""?","Quale copertura offre la garanzia ""Infortuni in Viaggio""?",,,,,,,,,,,,,,,,,,,,,,"La garanzia copre gli infortuni che si verificano durante i viaggi nello svolgimento di ogni attività che non abbia carattere professionale, e garantisce un capitale nel caso in cui l'infortunio causi la morte o un'invalidità permanente."
56af6bbfe0e2eee2aa00004c,Viaggi Nostop Vacanza,Info e Acquisto,Viaggi,Quali Paesi sono coperti per la polizza Viaggi Nostop Vacanza?,In quali paesi è valida la polizza Viaggi Nostop Vacanza?,Quali Paesi sono coperti  dalla polizza Viaggi Nostop Vacanza?,Quali sono i paesi in cui è attiva la polizza Viaggi Nostop Vacanza?,"Ho sottoscritto la polizza Viaggi Nostop Vacanza, in quali paesi sono assicurato?",,,,,,,,,,,,,,,,,,,,,,,,"La polizza sarà valida secondo l'estensione territoriale indicata sul modulo di polizza: Italia, Europa o Mondo.\n\nPaesi sempre esclusi sono: Afghanistan, Antartico, Cocos, Georgia del Sud, Heard e Mc Donald, Isola Bouvet, Isola Christmas, Isola Pitcairn, Isole Chagos, Isole Falkland, Isole Marshall, Isole Minori, Isole Salomone, Isole Wallis e Futuna, Kiribati, Micronesia, Nauru, Niue, Palau, Sahara Occidentale, Samoa, Sant'Elena, Somalia, Terre Australi Francesi, Timor Occidentale, Timor Orientale, Tokelau, Tonga, Tuvalu, Vanuatu. \n\nInoltre, le nostre polizze non sono valide per i Paesi ritenuti in stato di belligeranza, ovvero con un grado di rischio uguale o superiore a 4,0. \nPer verificare il grado di rischio, puoi collegarti al sito http://www.ihs.com/info/all/jccwatchlist.aspx ."
56af6bc1e0e2eee2aa000052,Viaggi Nostop Vacanza,Richiesta Assistenza,Viaggi,"Quando posso chiedere il ""rientro sanitario""?","Cos'è e come funziona il ""rientro sanitario""?","Quando posso chiedere il ""rientro sanitario""? ","In quali casi si può ottenere il ""rientro sanitario""?",,,,,,,,,,,,,,,,,,,,,,,,,"Il rientro sanitario avviene quando, in seguito a infortunio o malattia, l'assicurato necessita del trasporto in un istituto di cura attrezzato (in Italia) o del rientro alla sua residenza. Tale necessità è determinata a giudizio dei medici della Centrale Operativa Europ Assistance e in accordo con il medico curante sul posto. In quel caso il trasporto è interamente organizzato dalla Centrale Operativa, con spese a suo carico, e comprende l'assistenza medica o infermieristica durante il viaggio, nel caso i medici della Centrale Operativa la ritengano necessaria."
56af6bc2e0e2eee2aa000055,Viaggi Nostop Vacanza,Info e Acquisto,Viaggi,L'integrazione Responsabilità Civile mi copre se noleggio un auto o una moto all'estero?,Il noleggio di un'auto o di una moto all'estero è coperto dall'integrazione Responsabilità Civile?,Quali sono le condizioni dell'integrazione Responsabilità Civile?,In quali casi è valida l'integrazione Responsabilità Civile?,,,,,,,,,,,,,,,,,,,,,,,,,"No, la guida dei veicoli a motore è tra le esclusioni."
56af6bc3e0e2eee2aa000058,Viaggi Nostop Vacanza,Info e Acquisto,Viaggi,Cosa copre la garanzia bagaglio per la polizza Viaggi Nostop Vacanza?,Cosa copre la garanzia bagaglio per la polizza Viaggi Nostop Vacanza? ,Quali sono le condizioni della garanzia bagaglio per la polizza Viaggi Nostop Vacanza?,Quali coperture offre la garanzia bagaglio della polizza Viaggi Nostop Vacanza?,Come funziona la garanzia bagaglio per la polizza Viaggi Nostop Vacanza?,In quali casi è valida la garanzia bagaglio per la polizza Viaggi Nostop Vacanza?,,,,,,,,,,,,,,,,,,,,,,,"La garanzia copre il bagaglio e gli effetti personali dell'assicurato, inclusi gli abiti indossati, in caso di furto, incendio, rapina, scippo, mancata riconsegna e/o danneggiamento da parte del vettore.\nInoltre per la versione “Top” sono compresi in garanzia i telefoni cellulari, lettori MP3, personal computer, tablets, passeggini, carrozzine e attrezzatura sportiva (non professionale) imbarcata ad hoc."
56af6bc5e0e2eee2aa000061,Viaggi Nostop Annullamento,Rimborso Sinistri,Viaggi,Ho stipulato una polizza Viaggi Nostop Annullamento e ho necessità di riprogrammare il viaggio per il quale avevo sottoscritto la polizza: come posso procedere?,Come devo procedere se ho una polizza Viaggi Nostop Annullamento e devo ritardare la partenza del viaggio per cui avevo sottoscritto la polizza?,A chi mi devo rivolgere se ho la necessità di riprogrammare il viaggio per cui avevo sottoscritto la polizza Viaggi Nostop Annullamento?,Cosa devo fare in caso di necessità di riprogrammare la partenza di un viaggio per cui avevo stipulato la polizza Viaggi Nostop Annullamento? ,Come devo procedere in caso di ritardo della partenza di un viaggio per cui avevo sottoscritto la polizza Viaggi Nostop Annullamento?,Ho una polizza Viaggi Nostop Annullamento: quali istruzioni devo seguire in caso di partenza ritardata?,,,,,,,,,,,,,,,,,,,,,,,"Dovrai effettuare una denuncia entro e non oltre i 3 giorni dal rientro, accedendo al portale https://sinistrionline.europassistance.it seguendo le istruzioni oppure accedendo direttamente al sito www.europassistance.it sezione Sinistri. In alternativa puoi scrivere ad Europ Assistance – Ufficio Liquidazione Sinistri (Annullamento Viaggio) – Piazza Trento, 8 – 20135 Milano, e presentando entro 15 giorni dal rientro i seguenti documenti:\nDati anagrafici, codice fiscale e recapito,\nDocumentazione attestante la causa della ritardata partenza in originale,\nNuovi titoli di viaggio acquistati per raggiungere il luogo previsto del viaggio,\nRicevute di pagamento del viaggio o locazione,\nEstratto conto di conferma prenotazione emesso dall'Organizzazione/Agenzia Viaggi,\nTitoli di viaggio non utilizzati in originale.\nPer qualunque ulteriore informazione ti invitiamo a consultare il Fascicolo Informativo o a contattarci, dall'Italia, al numero verde 800.01.35.29 dal Lunedì al Sabato, esclusi i festivi, dalle ore 8.00 alle ore 20.00"
56af6bc8e0e2eee2aa00006a,Viaggi Nostop Annullamento,Info e Acquisto,Viaggi,Posso stipulare la polizza Viaggi Nostop Annullamento solo per il biglietto aereo?,Quali garanzie offre la polizza Viaggi Nostop Annullamento?,Posso stipulare la polizza Viaggi Nostop Annullamento solo per il biglietto aereo?,Quali servizi sono compresi nella polizza Viaggi Nostop Annullamento?,L'alloggio che ho prenotato è coperto dalla polizza Viaggi Nostopannullamento?,Quali coperture sono garantite dalla polizza Viaggi Nostop Annullamento?,Cosa include la polizza Viaggi Nostop Annullamento?,In cosa consiste la polizza Viaggi Nostop Annullamento?,,,,,,,,,,,,,,,,,,,,,"La nostra polizza Viaggi Nostop Annullamento assicura la biglietteria aereo o navale, pacchetti viaggio e locazione di immobili con regolare contratto."
56af6bcae0e2eee2aa000070,Viaggi Nostop Annullamento,Info e Acquisto,Viaggi,Se devo assicurare più persone per la poilizza Viaggi Nostop Annullamento che valore devo inserire?,Quale valore devo inserire per assicurare più persone con la polizza Viaggi Nostop Annullamento? ,Come faccio per assicurare più persone con la polizza Viaggi Nostop Annullamento?,Cosa devo fare per assicurare più persone con la polizza Viaggi Nostop Annullamento?,,,,,,,,,,,,,,,,,,,,,,,,,Va inserito il valore totale del viaggio
56af6bcde0e2eee2aa00007c,Viaggi Nostop Annullamento,Info e Acquisto,Viaggi,Quali casi di annullamento sono coperti nella polizza Viaggi Nostop Annullamento?,Quali casi di annullamento sono coperti dalla polizza Viaggi Nostop Annullamento?,Quali sono le condizioni per le quali un caso di annullamento viene considerato valido?,Come posso sapere se la causa di annullamento del mio viaggio è riconosciuta come valida?,,,,,,,,,,,,,,,,,,,,,,,,,"I casi di annullamento coperti sono tutte le cause oggettivamente documentabili e imprevedibili che colpiscano l'assicurato, un familiare, o il contitolare dell'azienda/studio associato"
56af6bcee0e2eee2aa00007f,Viaggi Nostop Annullamento,Rimborso Sinistri,Viaggi,Quali sono i tempi per comunicare l'annullamento del viaggio per la polizza Viaggi Nostop Annullamento?,"Ho una polizza Viaggi Nostop Annullamento, quali sono le tempistiche da rispettare per comunicare l'annullamento del viaggio?",Entro quale data devo comunicare l'annullamento del viaggio usufruendo della polizza Viaggi Nostop Annullamento?,Quando devo comunicare l'annullamento del viaggio?,,,,,,,,,,,,,,,,,,,,,,,,,L'assicurato deve effettuare la  denuncia ad Europ Assistance  entro e non oltre 3 giorni di calendario dal verificarsi della causa della rinuncia  e comunque entro la data di inizio viaggio.
56af6bcfe0e2eee2aa000082,Viaggi Nostop Annullamento,Info e Acquisto,Viaggi,Cosa viene rimborsato in caso di rinuncia al viaggio con la polizza Viaggi Nostop Annullamento?,"In caso di rinuncia al viaggio, quali rimborsi prevede la polizza Viaggi Nostop Annullamento",Cosa viene rimborsato dalla polizza Viaggi Nostop Annullamento?,Quali spese vengono coperte e rimborsate dalla polizza Viaggi Nostop Annullamento?,,,,,,,,,,,,,,,,,,,,,,,,,"Viene rimborsata  la  penale applicata contrattualmente dall'Organizzatore del viaggio, da una Compagnia Aerea o di Navigazione inclusi costi di gestione pratica, le  fee di agenzia, l'adeguamento del carburante e i visti. Nel caso di acquisto della sola biglietteria aerea il rimborso avverrà al netto delle tasse aereoportuali rimborsate dal vettore aereo."
56af6bd0e0e2eee2aa000085,Viaggi Nostop Annullamento,Info e Acquisto,Viaggi,Quando decorre la Polizza di annullamento Viaggio e fino a quanto dura?,Da quando ha effetto la polizza Viaggi Nostop Annullamento e fino a quanto è valida?,Quando decorre la polizza Viaggi Nostop Annullamento e fino a quanto dura?,Quando inizio a essere coperto dall'assicurazione Viaggi Nostop Annullamento?,Quando scade la polizza Viaggi Nostop Annullamento?,,,,,,,,,,,,,,,,,,,,,,,,"L'assicurazione nei confronti di ogni Assicurato decorre dalle ore 24.00 del giorno indicato nel Modulo di Polizza e scade alle ore 24.00 del giorno indicato nel Modulo stesso.\nLa garanzia decorre dalla data di iscrizione al viaggio e dura fino all'inizio del viaggio stesso, intendendosi per inizio del viaggio il momento in cui l'Assicurato avrebbe dovuto presentarsi alla stazione di partenza o al primo check-in in aeroporto o comunque fino alla fruizione del primo servizio contrattualmente previsto."
56af6bd1e0e2eee2aa000088,Viaggi Nostop Annullamento,Info e Acquisto,Viaggi,Esistono dei limiti di tempo entro i quali posso acquistare la Polizza di Annullamento Viaggio?,Esistono dei limiti di tempo entro i quali posso acquistare la polizza Viaggi Nostop Annullamento?,Entro quale data posso fare la mia richiesta per la polizza Viaggi Nostop Annullamento?,Fino a quando ho la possibilità di sottoscrivere la polizza Viaggi Nostop Annullamento?,Quali tempistiche devo rispettare per acquistare la polizza Viaggi Nostop Annullamento?,,,,,,,,,,,,,,,,,,,,,,,,Condizione necessaria per l'operatività della Polizza è sottoscriverla al più tardi entro le ore 24 del giorno successivo al giorno di iscrizione al viaggio o di prenotazione della biglietteria aerea o navale.
56af6bd2e0e2eee2aa00008b,Viaggi Nostop Annullamento,Info e Acquisto,Viaggi,"Nel caso in cui dovessi riprogrammare il viaggio, quali saranno le spese di Europ Assistance?","Nel caso in cui dovessi riprogrammare il viaggio, quali saranno le spese che mi rimborserà Europ Assistance?","In caso di riprogrammazione del viaggio, quali costi saranno coperti da Europ Assistance?",Quali sarebbero i rimborsi garantiti da Europ Assistance se fosse necessario annullare un viaggio e riprogrammarlo?,Quali rimborsi garantisce la polizza Viaggi Nostop Annullamento in caso di necessità di riprogrammare un viaggio?,,,,,,,,,,,,,,,,,,,,,,,,"Europ Assistance rimborsa all'Assicurato il 50%, con un massimo di 500,00 euro a persona e di 1500,00 euro per pratica di viaggio, degli eventuali costi maggiori sostenuti per acquistare nuovi titoli di viaggio (biglietteria aerea, marittima o ferroviaria), in sostituzione di quelli non utilizzabili per ritardato arrivo dell'Assicurato sul luogo di partenza determinato da una causa o un evento esterno. Europ Assistance rimborsa gli eventuali maggiori costi all'assicurato e, purché assicurati ed iscritti alla medesima pratica, ai componenti del nucleo familiare e/o ad uno dei compagni di viaggio."
56af6bd3e0e2eee2aa00008e,Viaggi Nostop Annullamento,Rimborso Sinistri,Viaggi,Come devo comportarmi in caso di rinuncia al viaggio?,Come devo comportarmi in caso di rinuncia al viaggio?,Come devo comportarmi in caso di annullamento di un viaggio?,Cosa devo fare se sono costretto a rinunciare al viaggio?,Come devo procedere in caso di annullamento del viaggio?,Come devo fare per denunciare la rinuncia al viaggio?,A chi mi devo rivolgere in caso di annullamento del viaggio?,"Se il viaggio venisse annullato, come dovrei comportarmi?",Quali sono le istruzioni da seguire in caso di rinuncia al viaggio?,,,,,,,,,,,,,,,,,,,,"In caso di modifica o forzata rinuncia al viaggio dovrai:\nComunicare all'organizzazione viaggi o agenzia la rinuncia formale al viaggio,\nEffettuare una denuncia entro e non oltre i 3 giorni dal verificarsi della causa della rinuncia e comunque entro la data di inizio viaggio se il termine di 3 giorni cade successivamente alla data di inizio del viaggio. La denuncia può essere inoltrata accedendo al portale https://sinistrionline.europassistance.it seguendo le istruzioni oppure accedendo direttamente al sito integration2 sezione sinistri.\nPer qualunque ulteriore informazione ti invitiamo a consultare il Fascicolo Informativo o a contattarci, dall'Italia, al numero verde 800.01.35.29 dal Lunedì al Sabato, esclusi i festivi, dalle ore 8.00 alle ore 20.00"
56af6bd5e0e2eee2aa000097,Medico Nostop Italy,Rimborso Sinistri,Viaggi,"Ho sottoscritto la Polizza Medico Nostop Italy, come devo comportarmi in caso di sinistro?","Ho una polizza Medico Nostop Italy, come devo comportarmi in caso di sinistro?","Ho stipulato una polizza Medico Nostop Italy e mi è sono stato coinvolto in un sinistro, cosa devo fare?",In caso di sinistro cosa devo fare se ho un polizza Medico Nostop Italy?,"Se sottoscrivo una polizza Medico Nostop Italy, quali istruzioni devo seguire in caso di sinistro?",Quali tempistiche devo rispettare per la denuncia del sinistro se ho una polizza Medico Nostop Italy?,,,,,,,,,,,,,,,,,,,,,,,"In caso di sinistro, successivamente al contatto telefonico con la Centrale Operativa, l'Assicurato dovrà effettuare una denuncia accedendo al portale https://sinistrionline.europassistance.it  seguendo le  istruzioni oppure inviare una denuncia scritta indirizzata a Europ Assistance S.p.A. - Piazza Trento, 8 - 20135 Milano, evidenziando sulla busta ""Ufficio Liquidazione Sinistri. \nLe tempistiche per la denuncia e i documenti da presentare sono indicati nel Fascicolo Informativo ""Obblighi dell'Assicurato in caso di sinistro"".\nSe necessiti di assistenza per la denuncia del sinistro puoi contattarci al N° Verde 800.90.48.91, operativo dal lunedì al sabato dalle 08.00 alle 20.00"
56af6bd7e0e2eee2aa00009d,Medico Nostop Italy,Info e Acquisto,Viaggi,Come posso fare per disdire la mia polizza Medico Nostop Italy?,Come faccio a disdire la mia polizza Medico Nostop Italy?,Come comunicare la disdetta della polizza Medico Nostop Italy?,Quali sono le istruzioni da seguire per disdire la polizza Medico Nostop Italy??,Come posso inviare la disdetta della polizza Medico Nostop Italy?,Come ottenere la disdetta delle polizza Medico Nostop Italy?,Voglio disdire la polizza Medico Nostop Italy: come faccio?,Quali sono le modalità per disdire la mia polizza Medico Nostop Italy?,,,,,,,,,,,,,,,,,,,,,"La polizza Medico NoStop Italy, anche nella formula annuale non prevede il tacito rinnovo ma decade automaticamente alla data di scadenza inserita in polizza."
56af6bd8e0e2eee2aa0000a0,Medico Nostop Italy,Info e Acquisto,Viaggi,Chi stipula la polizza Medico Nostop Italy?,Chi può stipulare la polizza Medico Nostop Italy?,Quali sono le caratteristiche del contraente della polizza Medico Nostop Italy?,Chi è il contraente della polizza Medico Nostop Italy?,,,,,,,,,,,,,,,,,,,,,,,,,"Il contraente, ovvero la persona fisica, di cittadinanza italiana o anche straniera, purché residente in Italia, o la persona giuridica con sede legale in Italia, che sottoscrive la polizza di assicurazione per sé o a favore di terzi e ne assume i relativi oneri."
56af6bdde0e2eee2aa0000af,Medico Nostop Italy,Info e Acquisto,Viaggi,Cosa offre la polizza Medico Nostop Italy?,Quali garanzie offre la polizza Medico Nostop Italy?,Quali spese sono coperte dalla polizza Medico Nostop Italy?,A chi è rivolta la polizza Medico Nostop Italy?,Cosa prevede la polizza Medico Nostop Italy?,In quali paesi è valida la polizza Medico Nostop Italy?,,,,,,,,,,,,,,,,,,,,,,,"La polizza Medico Nostop Italy è l'assicurazione sanitaria per gli stranieri che viaggiano in Italia e nei paesi dell'area Schengen.\nComprende l'assistenza sanitaria 24 su 24  ed in caso di infortunio o malattia improvvisa  il rimborso delle spese mediche, farmaceutiche o ospedaliere sostenute a seguito di cure non procrastinabili."
